General Information,"Latham Group specializes in fiberglass residential in-ground swimming pools, which can be installed more quickly than an in-ground concrete pool. Fiberglass pools give home owners the option of a saltwater pool without the risk of salt corrosion, according to the company, which also points out that saltwater is easier on the skin than water treated with typical pool chemicals. Latham sells swimming pools, pool liners and pool covers in partnership with over 6,000 dealers in 2020. From the prospectus: We are the largest designer, manufacturer and marketer of in-ground residential swimming pools in North America, Australia and New Zealand. We hold the No. 1 market position in North America in every product category in which we compete. We believe that we are the most sought-after brand in the pool industry and the only pool company that has established a direct relationship with the homeowner. We are Latham, The Pool CompanyTM. With an operating history that spans over 60 years, we offer the industry’s broadest portfolio of pools and related products, including in-ground swimming pools, pool liners and pool covers. In 2020, we sold over 8,700 fiberglass pools in the United States, which we believe represents approximately 1 out of every 10 in-ground swimming pools sold in the United States. We have a heritage of innovation. In an industry that has traditionally marketed on a business-to-business basis (pool manufacturer to dealer), we pioneered the first “direct-to-homeowner” digital and social marketing strategy that has transformed the homeowner’s purchase journey. Through this marketing strategy, we are able to create demand for our pools and generate and provide high quality, purchase-ready consumer leads to our dealer partners. In 2020, the first year in which all elements of our digital and social marketing strategy were available to homeowners, we have delivered over 45,000 consumer leads to our dealer network, representing growth of 210% over the prior year. Partnership with our dealers is integral to our collective success, and we have enjoyed long-tenured relationships averaging over 14 years. In 2020, we sold to over 6,000 dealers; we also entered into a new and exclusive long-term strategic partnership with the nation’s largest franchised dealer network. (Note: Latham Group priced its IPO on April 22, 2021, at $19 – the low end of its $19-to-$21 range – on 20 million shares to raise $380 million.)","Plastics Products - Swimming Pools, Liners & Covers",2175,1956,Contact Information,"787 Watervliet Shaker Road Latham, New York 12110",800-833-3800,https://www.lathampool.com/,"Latham Group, Inc.",Financial Information,$2408.6mil,$403.39 mil (last 12 months),$15.98 mil (last 12 months),IPO Profile,SWIM,NASDAQ,20.0,$19.00 - $19.00,$380.0 mil,Barclays/ BofA Securities/ Morgan Stanley/ Goldman Sachs,Nomura/ William Blair/ Baird/ KeyBanc Capital Markets/ Truist Securities,4/23/2021,Priced,Available only to Subscribers,Available only to Subscribers,Available only to Subscribers,Available only to Subscribers,
General Information,"We intend to focus our investment efforts on industries that complement our management team’s background within healthcare and healthcare-related industries, primarily in the United States and Canada. Specifically, we intend to prioritize innovative, development- or early commercial-stage companies focused on clinically-impactful and high growth opportunities within medical devices, diagnostics, and digital health (comprehensively referred to as “MedTech”), which we believe are opportunity-rich, but somewhat overlooked areas relative to the strategies of most other blank check companies currently outstanding, particularly those focused on the healthcare sector. (Note: LAVA Medtech Acquisition Corp. priced its SPAC IPO on Oct. 26, 2021, in sync with the terms in its prospectus: 10 million units at $10 each to raise $100 million.)",BLANK CHECKS,0,2021,Contact Information,"303 Wyman Street, Suite 300 Waltham, Massachusetts 02451",781-530-3868,,LAVA Medtech Acquisition Corp.,Financial Information,$125.0mil,$0 mil (last 12 months),$0 mil (last 12 months),IPO Profile,LVACU,NASDAQ,10.0,$10.00 - $10.00,$100.0 mil,RBC Capital Markets,-,10/27/2021,Priced,Available only to Subscribers,Available only to Subscribers,Available only to Subscribers,Available only to Subscribers,
General Information,"We are a biotechnology company focused on transforming cancer treatment by developing a platform of novel bispecific antibodies designed to selectively induce gamma-delta T cell-mediated immunity against tumor cells. Our approach activates Vg9Vd2 T cells, a specific and relatively abundant gamma-delta effector T cell subset, upon cross-linking to a selected tumor target by our bispecific gamma-delta T cell engagers, or gamma-delta bsTCEs. These cells have the natural ability to distinguish tumor cells from healthy cells by sensing certain intracellular metabolites that are enriched in cancer cells. Activated Vg9Vd2 T cells are engaged for direct tumor cell killing and, in addition, orchestrate an immunological cascade response that includes activation of innate and adaptive immune cells in the tumor microenvironment. Vg9Vd2 T cells belong to the first line of defense against cancer, with potential to elicit potent and durable responses in the clinic. Our preclinical data demonstrate that Vg9Vd2 T cell activation and killing of patient-derived tumor cells by our gamma-delta bsTCEs is potent and specific thereby providing a significant opportunity to address unmet medical needs, if approved. We expect that activation of adaptive immunity by our approach has the potential to provide durable immune responses with the potential of enhancing patient survival. We believe we are the only company developing bispecific gamma-delta T cell engaging antibodies for the treatment of cancer.",PHARMACEUTICAL PREPARATIONS,31,2016,Contact Information,"Yalelaan 60 3584 CM Utrecht, the Netherlands",+31 6 3000 3035,http://www.lavatherapeutics.com,LAVA Therapeutics BV,Financial Information,$380.3mil,$3.1 mil (last 12 months),$-13.9 mil (last 12 months),IPO Profile,LVTX,NASDAQ,6.7,$15.00 - $15.00,$100.5 mil,J.P. Morgan/ Jefferies/ SVB Leerink,Kempen & Co.,3/25/2021,Priced,Available only to Subscribers,Available only to Subscribers,Available only to Subscribers,Available only to Subscribers,
General Information,"This is the first blank-check company or SPAC established by Lazard, which was founded in 1848 in New Orleans. Lazard is one of the world’s leading financial advisory firms. As of Dec. 31, 2020, Lazard’s asset management business managed about $259 billion of assets on behalf of corporations, public funds, sovereign entities, endowments and foundations, labor funds, financial intermediaries and private clients, the prospectus says. Focus: We believe the growth-oriented subsectors of the healthcare, technology, energy transition, financial and consumer sectors present particularly attractive investment opportunities. (Note: Lazard Growth Acquisition Corp. I priced its SPAC IPO on Feb. 9, 2021, in line with the terms in the prospectus: 50 million units at $10 each to raise $500 million.)",BLANK CHECKS,0,2020,Contact Information,"30 Rockefeller Plaza New York, New York 10112",(212) 632-6000,,Lazard Growth Acquisition Corp. I,Financial Information,$625.0mil,$0 mil (last 12 months),$0 mil (last 12 months),IPO Profile,LGACU,NASDAQ,50.0,$10.00 - $10.00,$500.0 mil,Goldman Sachs,-,2/10/2021,Priced,Available only to Subscribers,Available only to Subscribers,Available only to Subscribers,Available only to Subscribers,
General Information,"We intend to focus our search for business combination targets in the Travel, Leisure & Hospitality industries, including technology and data companies operating in these industries, although we may pursue an acquisition in any business industry or sector, including, without limitation, real estate-related operating, technology and investment companies. We believe that our management team is well suited to identify, source, negotiate and execute an initial business combination with the ultimate goal of pursuing attractive risk-adjusted returns for our shareholders. The Travel, Leisure & Hospitality industries, thriving prior to the COVID-19 pandemic, have been significantly disrupted on account of the pandemic and its associated impact on global travel. Government-imposed shutdowns of travel and associated businesses have created an adverse environment in the near term for the Travel, Leisure & Hospitality industries by significantly contracting revenues streams. As vaccines are distributed globally and government-imposed shutdowns are loosened, we believe this contraction will reverse and these industries will grow significantly, especially to service pent-up demand for the experiential components of travel. This growth in turn will create opportunity for value creation through a strategic business combination with a well-positioned target business primed to capture market share. The essence of the Travel, Leisure & Hospitality industries is the desire for shared human experiences. Virtual mediums cannot adequately replicate the essence of these industries, creating a latent demand during the pandemic for the experiences these industries traditionally offer. We believe the Travel, Leisure & Hospitality industries are, therefore, well positioned to rebound from the COVID-19 pandemic induced contraction and we expect to target companies in this industry that will benefit from the value enhancement strategy we intend to implement through a business combination.",BLANK CHECKS,0,2020,Contact Information,"c/o The LCP Group, L.P. 50 Main Street, Suite 1410 White Plains, New York 10606",(914) 289-0224,,LCP Acquisition Corp.,Financial Information,$250.0mil,$0 mil (last 12 months),$0 mil (last 12 months),IPO Profile,LCPU,NASDAQ,20.0,$10.00 - $10.00,$200.0 mil,Deutsche Bank Securities,-,,Withdrawn,Available only to Subscribers,Available only to Subscribers,Available only to Subscribers,Available only to Subscribers,
General Information,"We are a recently formed blank check company incorporated as a Cayman Islands exempted company on October 7, 2020 for the purpose of effecting a merger, share exchange, asset acquisition, share purchase, reorganization or similar business combination with one or more businesses, which we refer to throughout this prospectus as our initial business combination. We have not identified any specific business combination target and we have not, nor has anyone on our behalf, engaged in any substantive discussions, directly or indirectly, with any business combination target with respect to an initial business combination with us. LETTER FROM OUR CHAIRMAN AND CEO SoftBank and its affiliates have a 40-year track record of successfully investing in major technological trends – first in software distribution, then the Internet and mobile, and now data and AI. We strongly believe we can replicate our track record in the rapidly evolving Latin American and Hispanic markets. We set out on a path to do just that with the launch of a $5 billion fund in early 2019 with one simple goal: to invest in bold founders who are building companies that will shape the future of Latin American and Hispanic markets.",BLANK CHECKS,0,2021,Contact Information,"600 BRICKELL AVENUE, SUITE 2650 MIAMI, FLORIDA 33138, US",,,LDH Growth Corp I,Financial Information,$250mil,$0 mil (last 12 months),$0 mil (last 12 months),IPO Profile,LDHAU,NASDAQ,20.0,$10.00 - $10.00,$200.0 mil,Citigroup/ J.P. Morgan,-,3/19/2021,Priced,Available only to Subscribers,Available only to Subscribers,Available only to Subscribers,Available only to Subscribers,
General Information,"Our objective is to pursue opportunities with high-quality software, Internet and technology-enabled companies. We believe the combination of experience in sourcing, investing, product and operating uniquely position our team to execute on a compelling business combination. (Incorporated in the Cayman Islands) Our sponsor is affiliated with Lead Edge, a growth equity investment firm based in New York, N.Y., and Santa Barbara, CA which has raised $3 billion in capital since inception. Lead Edge’s primary business is investing in public and private software, Internet and technology-enabled services companies globally. Mitchell H. Green, our Chairman and CEO, is the founder and managing partner of Lead Edge. Nimay Mehta, our president and CFO, and Brian Neider, our COO, are general partners at Lead Edge. (Note: Lead Edge Growth Opportunities Ltd. priced its SPAC IPO on March 22, 2021, in line with the terms in it prospectus: 30 million units at $10 each to raise $300 million.)",BLANK CHECKS,0,2020,Contact Information,"96 Spring St., 5th Floor New York, NY 10012",(212) 984-2421,,"Lead Edge Growth Opportunities, Ltd",Financial Information,$375.0mil,$0 mil (last 12 months),$0 mil (last 12 months),IPO Profile,LEGAU,NASDAQ,30.0,$10.00 - $10.00,$300.0 mil,Credit Suisse/ JPMorgan,-,3/23/2021,Priced,Available only to Subscribers,Available only to Subscribers,Available only to Subscribers,Available only to Subscribers,
General Information,"Our focus is on the education, training and education technology (EdTech) sectors. (Incorporated in the Cayman Islands) Our sponsor is an affiliate of Learn Capital and Commonwealth Asset Management (“CWAM”). Founded in 2008, Learn Capital is a leading venture capital firm created to focus exclusively on early-stage and mid-stage investments in the $5.4 trillion global education sector. By leveraging deep sector expertise and networks and sustained attention to emerging breakthroughs in technology-enabled education delivery, the firm has invested early in many of the sector’s largest and leading companies. In the last decade, Learn Capital has raised four funds totaling $600+ million in assets under management and invested in category-leading companies reaching learners globally. Learn Capital was founded by Rob Hutter and Greg Mauro, a team who formerly managed an affiliate of Founders Fund. Commonwealth Asset Management Holdings LLC (“CWAM Platform”) is a Los Angeles-based asset management platform founded in June 2019 and led by Adam Fisher, our President, and the former Head of Global Macro and Real Estate at Soros Fund Management LLC (“Soros”) and the former founder and Chief Investment Officer of Commonwealth Opportunity Capital, GP LLC (“CWOC”). At the time of its closing in June 2017, CWOC was a $2.3 billion discretionary global macro platform. It was launched in 2008 and began the process of returning capital to investors in July 2017 when the investment team moved to Soros. The firm was founded and led by CIO Adam Fisher and offered two comingled hedge funds, as well as multiple co-investment opportunities in both the liquid and illiquid space. (Note: Learn CW Investment Corp. did NOT price its SPAC IPO on Oct. 7, 2021, as some had expected. The blank check company downsized its SPAC IPO to 20 million units, down from 25 million units, at $10 each in an S-1/A filing dated Sept. 16, 2021.)",BLANK CHECKS,0,2021,Contact Information,"11755 Wilshire Blvd. Suite 2320 Los Angeles, California 90025",(424) 324-2990,,Learn CW Investment Corp.,Financial Information,$225.0mil,$0 mil (last 12 months),$0 mil (last 12 months),IPO Profile,LCW.U,NYSE,20.0,$10.00 - $10.00,$200.0 mil,Evercore ISI,,10/8/2021,,Available only to Subscribers,Available only to Subscribers,Available only to Subscribers,Available only to Subscribers,Friday
General Information,"We intend to focus our search on the financial technology sector, which complements the expertise of our management team. We currently intend to concentrate our efforts identifying businesses in the financial services industry with an enterprise value of approximately $600 million to $1.3 billion, with particular emphasis on businesses that are providing or changing technology for traditional financial services (“FinTech”), regulatory and compliance functions (“RegTech”), insurance services (“InsurTech”), wealth and asset management and human resource and payroll functions.",BLANK CHECKS,0,2020,Contact Information,"292 Newbury Street Suite 293 Boston, MA 02115",(617) 510-1991,,Lefteris Acquisition Corp.,Financial Information,$256.25mil,$0 mil (last 12 months),$0 mil (last 12 months),IPO Profile,LFTRU,NASDAQ,20.0,$10.00 - $10.00,$200.0 mil,Morgan Stanley,,10/21/2020,Priced,Available only to Subscribers,Available only to Subscribers,Available only to Subscribers,Available only to Subscribers,
General Information,"Our mission is to democratize law. We believe every business deserves the full protection of the legal system and a simple way to stay compliant with it. Our platform helps new businesses form. Once a small business is formed, we offer subscription services to protect the business, its ideas, and the families that create them. LegalZoom empowers small business owners to apply their energy and passion to their businesses instead of the legal and regulatory complexity required to operate them. LegalZoom is a leading online platform for legal and compliance solutions in the United States. In 2020, 10% of new limited liability companies, or LLCs, and 5% of new corporations in the United States were formed via LegalZoom. Our unique position at business inception allows us to become a trusted business advisor, supporting the evolving needs of a new business across its lifecycle. Along with formation, LegalZoom offerings include ongoing compliance and tax advice and filings, trademark filings, and estate plans. Additionally, we have unique insights into our customers and leverage our product as a channel to introduce small businesses to leading brands in our partner ecosystem, solving even more of their business needs. We operate across all 50 states and over 3,000 counties in the United States, and have more than 20 years of experience navigating complex regulation and simplifying the legal and compliance process for our customers. (Note: LegalZoom priced its IPO on June 29, 2021, at $28 – above its $24-to-$27 price range – on 19.12 million shares, the same number of shares in the prospectus, to raise $535.36 million.)","COMPUTER PROGRAMMING, DATA PROCESSING",1055,1999,Contact Information,"101 North Brand Boulevard, 11th Floor Glendale, California 91203",(323) 962-8600,http://www.legalzoom.com/,"LegalZoom.com, Inc",Financial Information,$4949.81mil,$499.47 mil (last 12 months),$-4.8 mil (last 12 months),IPO Profile,LZ,NASDAQ,19.1,$28.00 - $28.00,$535.4 mil,J.P. Morgan/ Morgan Stanley/ Barclays/ BofA Securities/ Citigroup/ Credit Suisse/ Jefferies,JMP Securities/ Raymond James/ William Blair/ AmeriVet Securities/ Penserra Securities LLC/ Telsey Advisory Group/ Siebert Williams Shank,6/30/2021,Priced,Available only to Subscribers,Available only to Subscribers,Available only to Subscribers,Available only to Subscribers,
General Information,"We intend to initially focus on target businesses in the renewables, infrastructure, energy and construction and industrial industries. We will seek to capitalize on the experience of our management team in consummating an initial business combination. Eric S. Rosenfeld, our Chief SPAC Officer, and David D. Sgro, our Chief Executive Officer, have led six prior public blank check companies. (*See prospectus for details.) (Note: Legato Merger Corp. upsized its IPO at pricing to 20.5 million units, up from 17.5 million units, at $10 each to raise $205 million.)",BLANK CHECKS,0,2020,Contact Information,"777 Third Avenue, 37th Floor New York, New York 10017",(212) 319-7676,,Legato Merger Corp.,Financial Information,$225.6mil,$0 mil (last 12 months),$0 mil (last 12 months),IPO Profile,LEGOU,NASDAQ,20.5,$10.00 - $10.00,$205.0 mil,"EarlyBirdCapital, Inc.",I-Bankers,1/20/2021,Priced,Available only to Subscribers,Available only to Subscribers,Available only to Subscribers,Available only to Subscribers,
General Information,"We currently intend to focus on target businesses in the infrastructure, engineering and construction (“E&C”), industrial and renewables industries. Eric S. Rosenfeld, our Chief SPAC Officer, and David D. Sgro, our Vice Chairman of the Board, have led seven prior public blank check companies: (i) Arpeggio Acquisition Corporation, or “Arpeggio,” which raised $40.8 million in June 2004 and consummated a business combination with Hill International, Inc., or “Hill International,” in June 2006, (ii) Rhapsody Acquisition Corp., or “Rhapsody,” which raised $41.4 million in October 2006 and consummated a business combination with Primoris Corporation, or “Primoris,” in July 2008, (iii) Trio Merger Corp., or “Trio,” which raised $69 million in June 2011 and consummated a business combination with SAExploration Holdings Inc., or “SAE,” in June 2013, (iv) Quartet Merger Corp., or “Quartet,” which raised $96.6 million in November 2013 and consummated a business combination with Pangea Logistics Solutions Ltd., or “Pangaea,” in October 2014, (v) Harmony Merger Corp., or “Harmony,” which raised $115.0 million in March 2015 and consummated a business combination with NextDecade LLC, or “NextDecade,” in July 2017, (vi) Allegro Merger Corp, or “Allegro,” which raised $149.5 million and executed a definitive merger agreement with TGI Fridays’ that was later terminated due largely to the COVID-19 pandemic and (vii) Legato Merger Corp., or “Legato I,” which raised approximately $235.8 in January 2021 and consummated a business combination with Algoma Steel Group Inc, or “Algoma,” in October 2021. Note: “Our initial stockholders and EarlyBirdCapital, Inc., the representative of the underwriters in this offering, have committed that they and/or their designees will purchase from us an aggregate of 905,000 units, or “private units,” at $10.00 per unit for a total purchase price of $9,050,000 in a private placement that will occur simultaneously with the consummation of this offering. Each private unit will consist of one share of common stock, or “private shares,” and one-half of one warrant, or “private warrants.”,” the prospectus says. (Note: Legato Merger Corp. II upsized its SPAC IPO at pricing on Monday morning, Nov. 22, 2021, before the U.S. stock market opened: 24 million units, up from 20 million units in the prospectus, at $10 each to raise $240 million. Legato II’s stock and warrants are expected to start trading the same day – Monday, Nov. 22, 2021 – on the NASDAQ.)",BLANK CHECKS,0,2021,Contact Information,"777 Third Avenue, 37th Floor New York, New York 10017",(212) 319-7676,,LEGATO MERGER CORP. II,Financial Information,$261.05mil,$0 mil (last 12 months),$0 mil (last 12 months),IPO Profile,LGTOU,NASDAQ,24.0,$10.00 - $10.00,$240.0 mil,EarlyBirdCapital,-,11/22/2021,Priced,Available only to Subscribers,Available only to Subscribers,Available only to Subscribers,Available only to Subscribers,
General Information,"We are a global, clinical-stage biopharmaceutical company engaged in the discovery and development of novel cell therapies for oncology and other indications. Our team of over 650 employees in the United States, China and Europe, our differentiated technology, global development and manufacturing strategy and expertise provide us with the ability to generate, test and manufacture next-generation cell therapies targeting indications with high unmet needs. Our lead product candidate, LCAR-B38M/JNJ-4528, is a chimeric antigen receptor, or CAR, T cell therapy we are jointly developing with our strategic partner, Janssen Biotech, Inc., or Janssen, for the treatment of multiple myeloma, or MM.",PHARMACEUTICAL PREPARATIONS,645,2014,Contact Information,"2101 Cottontail Lane, Somerset, NJ 08873, US",(732) 317-5050,http://www.legendbiotech.com,Legend Biotech,Financial Information,$2961.1mil,$58.8 mil (last 12 months),$-164.8 mil (last 12 months),IPO Profile,LEGN,NASDAQ,18.4,$23.00 - $23.00,$423.8 mil,Morgan Stanley/ J.P. Morgan Securities/ Jefferies,-,6/5/2020,Priced,Available only to Subscribers,Available only to Subscribers,Available only to Subscribers,Available only to Subscribers,
General Information,"Lemonade is rebuilding insurance from the ground up on a digital substrate and an innovative business model. By leveraging technology, data, artificial intelligence, contemporary design and behavioral economics, we believe we are making insurance more delightful, more affordable, more precise and more socially impactful. To that end, we have built a vertically integrated company with wholly owned insurance carriers in the United States and Europe, and the full technology stack to power them.","FIRE, MARINE & CASUALTY INSURANCE",329,2015,Contact Information,"5 Crosby Street, 3rd Floor, New York, NY 10013, US",(844) 733-8666,http://www.lemonade.com,Lemonade,Financial Information,$1592mil,$82.5 mil (last 12 months),$-123.4 mil (last 12 months),IPO Profile,LMND,NYSE,11.0,$29.00 - $29.00,$319.0 mil,Goldman Sachs/ Morgan Stanley/ Allen & Company/ Barclays Capital,JMP Securities/ Oppenheimer/ William Blair/ LionTree,7/2/2020,Priced,Available only to Subscribers,Available only to Subscribers,Available only to Subscribers,Available only to Subscribers,
