General Information,"Our mission is to enable everyone to showcase vocal talent. Driven by this, we have transformed the audio industry to create Lizhi, a mobile app for everyone to create, store, share, discover and enjoy audio, and interact through it. Over 100 years ago, radio was invented to connect the world through human voices. Its massive reach, seamless transmission, and ubiquitous presence have changed and enriched everyone’s life. Fifteen years ago, the rapid development of internet gave rise to podcasts, attracting a younger audience and nurturing audio hosts of the future. We are the largest online UGC audio community in China as of September 30, 2019 according to iResearch. We are also the largest interactive audio entertainment platform and the second largest online audio platform in China in terms of average total MAUs for the nine months ended September 30, 2019 according to the same source. According to iResearch, our MAU market share in the interactive audio entertainment market and online audio market was 70.7% and 18.4%, respectively, for the nine months ended September 30, 2019.","COMPUTER PROGRAMMING, DATA PROCESSING",620,2010,Contact Information,"Yangcheng Creative Industry Zone, No. 309 Middle Huangpu Avenue, Tianhe District, Guangzhou 510655, People’s Republic of China",+86 20 8381-8791,http://www.lizhi.fm,LIZHI,Financial Information,$503.1mil,$151.9 mil (last 12 months),$-119.1 mil (last 12 months),IPO Profile,LIZI,NASDAQ,4.1,$11.00 - $11.00,$45.1 mil,Citigroup,Haitong International/ AMTD/ Needham/ Tiger Brokers/ China Merchants Securities (HK)/ Valuable Capital/ Prime Number Capital,1/17/2020,Priced,Available only to Subscribers,Available only to Subscribers,Available only to Subscribers,Available only to Subscribers,
General Information,"We expect to focus on acquiring a business combination target within the financial services industry and related sectors, including potentially the FinTech sector, with an enterprise value of approximately $250 million to $500 million. This SPAC is led by Bruce Rodgers, the founder of LM Funding America (NASDAQ:LMFA), a company that buys delinquent homeowner association debt. (Note: LMF Acquisition Opportunities upsized its IPO at pricing: 9.0 million units, up from 7.5 million initially, were priced at $10 each to raise $90 million.)d",BLANK CHECKS,0,2020,Contact Information,"1200 W. Platt St., Suite 100 Tampa, Florida 33606",(813) 222-899,,"LMF Acquisition Opportunities, Inc.",Financial Information,$109.5mil,$0 mil (last 12 months),$0 mil (last 12 months),IPO Profile,LMAOU,NASDAQ,9.0,$10.00 - $10.00,$90.0 mil,Maxim Group LLC,-,1/26/2021,Priced,Available only to Subscribers,Available only to Subscribers,Available only to Subscribers,Available only to Subscribers,
General Information,"Our goal is to provide an e-commerce and facilities-based retail platform for consumers who desire to buy, sell, rent, subscribe for or finance pre-owned and new automobiles. We seek to provide our customers with a simple, convenient, transparent and pleasant retail experience. In addition to our current operations launched in 2017, we intend to seek strategic acquisitions of pre-owned and new automobile dealerships and car rental companies in order to facilitate efficient growth.",AUTO DEALERS & GASOLINE STATIONS,11,2017,Contact Information,"601 N. State Road 7, Plantation FL, 33317, US",(954) 895-0352,http://www.lmpmotors.com,LMP Automotive Holdings,Financial Information,$41.5mil,$13.6 mil (last 12 months),$-6.4 mil (last 12 months),IPO Profile,LMPX,NASDAQ,2.3,$5.00 - $5.00,$11.5 mil,ThinkEquity (a division of Fordham Financial Management),-,12/5/2019,Priced,Available only to Subscribers,Available only to Subscribers,Available only to Subscribers,Available only to Subscribers,
General Information,"loanDepot is a customer-centric, technology-empowered residential mortgage platform with a widely recognized consumer brand. We launched our business in 2010 to disrupt the legacy mortgage industry and make obtaining a mortgage a positive experience for consumers. We have built a leading technology platform, designed around the consumer, which has redefined the mortgage process. Our digital-first approach has allowed us to become one of the fastest-growing, at-scale mortgage originators in the U.S. We are the second-largest retail-focused non-bank mortgage originator and the fifth-largest overall retail originator, according to Inside Mortgage Finance. We originated $79.4 billion of loans for the 12 months ended Sept. 30, 2020, and experienced 116% year-over-year origination volume growth for the nine months ended Sept. 30, 2020. (Note: The Street hears that loanDepot is expected to price tonight, Feb. 10, following an S-1/A filing dated Feb. 9, showing the same terms – 15 million shares at $19 to $21 – but this timetable is nearly a week after the IPO’s initially expected pricing date.)",FINANCE SERVICES,8614,2010,Contact Information,"26642 Towne Centre Drive, Foothill Ranch, California 92610, US",(888) 337-6888,http://www.loandepot.com,loanDepot,Financial Information,$6499.9mil,$3429.1 mil (last 12 months),$1482.2 mil (last 12 months),IPO Profile,LDI,NYSE,3.9,$14.00 - $14.00,$53.9 mil,Goldman Sachs/ BofA Securities/ Credit Suisse/ Morgan Stanley/ Barclays/ Citigroup/ Jefferies/ UBS Investment Bank,JMP Securities/ Nomura/ Piper Sandler/ Raymond James/ William Blair,2/11/2021,Priced,Available only to Subscribers,Available only to Subscribers,Available only to Subscribers,Available only to Subscribers,
General Information,"(Note: This is an IPO unit offering. IPOScoop has NO CALL on unit IPOs. Locafy Limited is offering 1.82 million units – up to $10 million in estimated IPO proceeds – at an IPO price expected to be between $4.50 and $6.50 per unit, according to its F-1/A filing dated March 7, 2022. The assumed IPO price is $5.50 per unit. From the prospectus: “The final offering price per unit will be determined through negotiations between us and the representative of the underwriters, after taking into account market conditions and other factors.” Each unit consists of one ordinary share and one warrant. Locafy has applied to list its ordinary shares and warrants on the NASDAQ under the symbols “LCFY” and “LCFYW”.) We are an Australian company currently focused on commercializing our Software as a Service (SaaS) online publishing platform. Key aspects of our platform are patented in the United States. Central to our platform is the ability to publish almost any type of content to almost any device that uses a web browser to display web content. Further to that, our platform programmatically optimizes the published content for local search. Once data is integrated with our platform, the production of pages is largely automated. This enables the publication of large volumes of landing pages optimized for customer relevant search queries for local products and services in target locations. “Local search” is one of the strongest emerging trends in search engine optimization, with consumers increasingly searching for products and services in close proximity to their immediate location. Approximately 46% of all online search is “local”. We provide businesses an automated and cost-effective solution to increase their online visibility. The objective is to increase the likelihood that local consumers will find our customer’s business online when searching for local products and services, regardless of search method. Regardless of whether the consumer is searching using more traditional means, such as by typing, or by using more modern methods such as voice search (e.g., Google Home, Alexa, Siri), a recent emergent trend, the landing pages are designed to be found for relevant search terms, locally. This is achieved through the automated attribution of schema and speakable codes to published content, which ensures that content and the context in which it is used is understood by all device types, including voice assistants. The landing pages produced by our platform contain features that would otherwise require significant manual effort to achieve, or the application of additional and more expensive solutions. Our technology results in fast page load speed and the seamless delivery of content to all device types due to the platform’s adaptive nature of publishing content, and the automated attribution of security. We believe the results recently achieved in multiple markets, including North America, Australia and the UK, demonstrate the capability of our technology. Across 21,960 landing pages published up to November 28, 2021, more than 50% of these pages appeared in page one search results for the target keyword and location, while more than 33% of pages appeared in either the first, second and third positions on Page 1. The importance of Page 1 results is exemplified by consumer behavior studies that found more than 95% of consumers were more likely to enter a new search query than to proceed to page 2 of a search result. Specifically, our technology is able to process structured data provided in standard technical formats (for example, XML, JSON, CSV and XLS) of any quantity, to be published to any web browser and made accessible on any viewing device that uses a browser to display content, including smart phones, tablets, laptops, desktops and wearables (in so far as the content from data feeds can be published on a myriad of devices). Data may be transmitted via Web Application Programming Interface (“API”), File Transfer Protocol (FTP) or local upload. In March 2016, we were granted a patent in the United States (Patent Number US 9286274) relating to this process. **Note: Revenue for the year ended June 30, 2021, was A$2.91 million and the total comprehensive loss for the year was A$997,419, according to the prospectus. (A$: Australian dollars) Converted to US$ (presented below in this IPO Profile): Revenue was US$2.19 million and the total comprehensive loss was US$749,031.19 for the year ended June 30, 2021. (Note: Locafy Limited announced that it had priced its unit IPO at $4.125 per unit and raised $6 million; that works out to 1.45 million units priced – below the 1.82 million units in the prospectus. The stock and warrants were expected to start trading Friday, March 25, 2022, on the NASDAQ. Before the IPO was priced, the symbol was “LCFYU”.)",Prepackaged Software,,2009,Contact Information,"246A Churchill Avenue Subiaco WA 6008, Australia",+61 409 999 339,http://www.locafy.com/,Locafy Limited,Financial Information,$114.02mil,$2.19 mil (last 12 months),$-0.75 mil (last 12 months),IPO Profile,LCFY,NASDAQ,1.5,$4.13 - $4.13,$6.0 mil,H.C. Wainwright & Co.,-,3/25/2022,Priced,Available only to Subscribers,Available only to Subscribers,Available only to Subscribers,Available only to Subscribers,
General Information,"We intend to focus on healthcare and healthcare-related businesses in the United States and Europe, with a priority on companies in the life sciences sector. Our sponsor is an affiliate of Locust Walk Partners, a leading global life sciences transaction firm. Since its founding in 2008, Locust Walk Partners has focused exclusively on the healthcare industry, where it works with emerging life sciences companies to complete transformative transactions, including global or regional partnerships, mergers and acquisitions, and financings. Locust Walk Partners teams up with life sciences companies to help them define and implement their research and development, corporate development, business development and/or financing strategies. Locust Walk Partners then assists in executing on those strategies through one or more transactions, including licensing transactions, mergers and acquisitions, and raising capital on a global and/or regional basis. Locust Walk Partners’ clients include private and public biopharmaceutical companies developing innovative therapies at all stages of development, as well as medical device, diagnostic and digital health companies.",BLANK CHECKS,0,2020,Contact Information,"c/o Ledgewood PC Two Commerce Square 2001 Market Street, Suite 3400 Philadelphia, PA 19103",(215) 731-9450,,Locust Walk Acquisition,Financial Information,$163mil,$0 mil (last 12 months),$0 mil (last 12 months),IPO Profile,LWACU,NASDAQ,15.3,$10.00 - $10.00,$153.0 mil,Cantor,-,1/8/2021,Priced,Available only to Subscribers,Available only to Subscribers,Available only to Subscribers,Available only to Subscribers,
General Information,"We intend to focus our search on innovation in the logistics industry, which includes both logistics technology companies and traditional industry players that can leverage technology to improve the efficiency of customer supply chains and their markets. Alan Gershenhorn, our CEO, recently retired from his position as executive vice president and chief commercial officer of United Parcel Service, Inc. He is currently a senior advisor to EIGHT VC Partners, LLC (“8VC”). (Note: Logistics Innovation Technologies Corp. further downsized its SPAC IPO at pricing on June 10, 2021, to 30 million units – down from its previously downsized offering of 35 million units – at $10 each to raise $300 million. The SPAC’s size was previously cut to 35 million units from its initial size of 40 million, according to an S-1/A filing dated April 1, 2021.)",BLANK CHECKS,0,2021,Contact Information,"3348 Peachtree Road Suite 700 Atlanta, GA 30326",(678) 954-4822,,Logistics Innovation Technologies Corp.,Financial Information,$387.5mil,$0 mil (last 12 months),$0 mil (last 12 months),IPO Profile,LITTU,NASDAQ,30.0,$10.00 - $10.00,$300.0 mil,Guggenheim Securities,,6/11/2021,Priced,Available only to Subscribers,Available only to Subscribers,Available only to Subscribers,Available only to Subscribers,
General Information,"We are a technology-driven, comprehensive distributor and smart retailer of fresh and healthy products in China with a focus on health and sustainability. Our name “Lohas” is an acronym for Lifestyles of Health and Sustainability, which is the core philosophy we deeply embrace. We have extensive experience in fresh produce supply chain management and currently have 102 overseas and 5 domestic suppliers in 16 countries. We are committed to providing our customers with high-end quality products, which mainly consist of imported fruits, wild-harvested seafood, green vegetables and eggs, as well as nutritious dry goods.",WHOLESALE-GROCERIES & RELATED PRODUCTS,60,2013,Contact Information,"Room 818, Yisibo Software Building, Haitian 2nd Road, Nanshan District, Shenzhen, Guangdong Province 518000 People’s Republic of China",+86 755-33093707,http://www.lohas.sh/en,Loha Co. Ltd,Financial Information,$354.18mil,$105.4 mil (last 12 months),$8.7 mil (last 12 months),IPO Profile,LOHA,NASDAQ,4.3,$5.00 - $7.00,$25.7 mil,Maxim Group. Tiger Brokers/ Valuable Capital/ Prime Number Capital,-,,TBA,Available only to Subscribers,Available only to Subscribers,Available only to Subscribers,Available only to Subscribers,
General Information,"We are a clinical-stage biopharmaceutical company focused on developing novel transformative medicines for neurological diseases. We were formed in January 2020 by Arena Pharmaceuticals, Inc. (Arena) to advance a portfolio of centrally acting product candidates designed to be highly selective for specific G protein-coupled receptors (GPCRs). Our small molecule product candidates were discovered out of the same platform at Arena that represents a culmination of more than 20 years of GPCR research. Our pipeline includes: *LP352, an oral centrally acting 5-hydroxytryptamine 2c receptor subtype (5-HT2c) super agonist, to treat developmental and epileptic encephalopathies (DEEs), including Dravet syndrome and Lennox-Gastaut syndome; this drug candidate is in a Phase 1 clinical trial, and we expect to initiate a Phase 1b/2a clinical trial in the first quarter of 2022; *LP143, a centrally active full cannabinoid Type 2 receptor (CB2) agonist in IND-enabling studies to treat neurodegenerative diseases associated with neuroinflammation caused by microglial activation, including amyotrophic lateral sclerosis (ALS), and *LP659, a centrally acting sphingosine-1 phosphate (S1P) receptor subtypes 1 and 5 (S1P1,5) modulator in IND-enabling studies for central nervous system (CNS) neuroinflammatory diseases. (IND stands for investigational new drug, a type of FDA application and authorization.) (Note: Longboard Pharmaceuticals priced its IPO on March 10, 2021: 5 million shares at $16 – the high end of its $14-to-$16 range – to raise $80 million.)",Pharmaceuticals,6,2020,Contact Information,"6154 Nancy Ridge Drive San Diego, California 92121",(619) 592-9775,http://www.longboardpharma.com/,"Longboard Pharmaceuticals, Inc.",Financial Information,$253.8mil,$0 mil (last 12 months),$-14.4 mil (last 12 months),IPO Profile,LBPH,NASDAQ,5.0,$16.00 - $16.00,$80.0 mil,Citigroup/Evercore ISI/Guggenheim Securities/Cantor,-,3/12/2021,Priced,Available only to Subscribers,Available only to Subscribers,Available only to Subscribers,Available only to Subscribers,
General Information,"We are a clinical-stage biotechnology company developing cellular therapies for specific aging-related and life-threatening conditions. Our lead investigational product is the LOMECEL-B™ cell-based therapy product (“Lomecel-B”), which is derived from culture-expanded medicinal signaling cells (MSCs) that are sourced from bone marrow of young healthy adult donors. We believe that by using the same cells that promote tissue repair, organ maintenance, and immune system function, we can develop safe and effective therapies for some of the most difficult disorders associated with the aging process and other medical disorders. We are currently sponsoring Phase 1 and 2 clinical trials in the following indications: Aging Frailty, Alzheimer’s disease, the Metabolic Syndrome, Acute Respiratory Distress Syndrome (ARDS), and hypoplastic left heart syndrome (HLHS). Our mission is to advance Lomecel-B and other cell-based product candidates into pivotal Phase 3 trials, with the goal of achieving regulatory approvals, subsequent commercialization and broad use by the healthcare community.",Pharmaceuticals,16,2014,Contact Information,"1951 NW 7th Avenue, Suite 520 Miami, Florida 33136",(305) 909-0840,http://www.longeveron.com,Longeveron LLC,Financial Information,$187mil,$6.29 mil (last 12 months),$-2.8 mil (last 12 months),IPO Profile,LGVN,NASDAQ,2.7,$10.00 - $10.00,$26.6 mil,Kingswood Capital Markets,Alexander Capital L.P.,2/12/2021,Priced,Available only to Subscribers,Available only to Subscribers,Available only to Subscribers,Available only to Subscribers,
General Information,"We intend to focus on the industries that align with the background of the sponsor, with a particular emphasis placed on the healthcare sector. These industries include healthcare, industrials, consumer, media, technology and technology services. We will seek to acquire established businesses that we believe are fundamentally sound but potentially in need of financial, operational, or strategic assistance to maximize value.",BLANK CHECKS,0,2020,Contact Information,"767 Fifth Avenue, 44th Floor, New York, NY 10153, US",(212) 812-4700,,Longview Acquisition,Financial Information,$375mil,$0 mil (last 12 months),$0 mil (last 12 months),IPO Profile,LGVW.U,NYSE,36.0,$10.00 - $10.00,$360.0 mil,Cowen/ UBS Investment Bank,-,5/21/2020,Priced,Available only to Subscribers,Available only to Subscribers,Available only to Subscribers,Available only to Subscribers,
General Information,"We intend to focus on the industries that align with the background of the sponsor with a particular emphasis placed on the healthcare sector. These industries include healthcare, industrials, consumer, media, technology and technology services. We will seek to acquire established businesses that we believe are fundamentally sound but potentially in need of financial, operational, or strategic assistance to maximize value. The blank-check company was founded by our sponsor, an affiliate of Glenview Capital Management, a New York-based registered investment adviser with approximately $3.6 billion in assets under management as of Feb. 28, 2021.",BLANK CHECKS,0,2020,Contact Information,"767 Fifth Avenue, 44th Floor New York, NY 10153",(212) 812-4700,,Longview Acquisition Corp. II,Financial Information,$635.0mil,$0 mil (last 12 months),$0 mil (last 12 months),IPO Profile,LGV.U,NYSE,60.0,$10.00 - $10.00,$600.0 mil,UBS Investment Bank/Cowen & Co.,-,3/19/2021,Priced,Available only to Subscribers,Available only to Subscribers,Available only to Subscribers,Available only to Subscribers,
General Information,"We are a commercial-stage medical diagnostics technology company focused on the millions of patients with gastroesophageal reflux disease (GERD), also known as chronic heartburn, acid reflux or simply reflux, who are at risk of developing esophageal precancer and cancer, specifically highly lethal esophageal adenocarcinoma (EAC). We believe that our lead products, the EsoGuard® Esophageal DNA Test performed on samples collected with the EsoCheck® Esophageal Cell Collection Device, constitute the first and only commercially available diagnostic test capable of serving as a widespread screening tool to prevent EAC deaths, through early detection of esophageal precancer in at-risk GERD patients. The technologies were highlighted in the NCI’s Annual Plan and Budget Proposal for FY2020 to Congress as one of the year’s significant advances in cancer prevention. We believe EsoGuard could have as great an impact in preventing EAC deaths as widespread Pap test screening has had in preventing cervical cancer deaths. We were formed in May 2018 as a subsidiary of our parent company, PAVmed Inc. (Nasdaq: PAVM), to license the technologies underlying EsoGuard and EsoCheck from Case Western Reserve University (CWRU). PAVmed Inc., or “PAVmed,” currently owns approximately 72.6% of our outstanding common stock, and is our controlling stockholder. After the IPO, PAVmed will continue to be the controlling stockholder. As of the date of this prospectus, we have no employees. PAVmed makes certain of its employees available to us pursuant to a management services agreement between us executed concurrently with the License Agreement in May 12, 2018. Members of our leadership team are covered under the management services agreement, including Lishan Aklog, M.D., who will become our CEO upon consummation of this offering; Dennis McGrath, our CFO, and David Wurtman, M.D., our chief medical officer. (Note: Lucid Diagnostics priced its IPO on Oct. 13, 2021, at $14 – the bottom of its $14-to-$16 price range – and sold 5 million shares, the same number of shares in the prospectus, to raise $70 million. Lucid Diagnostics had filed confidentially for an IPO on Jan. 21, 2021.)",SERVICES-COMMERCIAL PHYSICAL & BIOLOGICAL RESEARCH,0,2018,Contact Information,"One Grand Central Place Suite 4600 New York, New York 10165",212-949-4319,http://www.luciddx.com/,Lucid Diagnostics Inc.,Financial Information,$517.86mil,$0 mil (last 12 months),$-14.57 mil (last 12 months),IPO Profile,LUCD,NASDAQ,5.0,$14.00 - $14.00,$70.0 mil,Cantor/ Canaccord Genuity,BTIG/ Needham & Co.,10/14/2021,Priced,Available only to Subscribers,Available only to Subscribers,Available only to Subscribers,Available only to Subscribers,
General Information,"We are a medical technology company focused on the development and commercialization of transformative and innovative infectious disease test kits. We developed a testing platform that produces centralized-laboratory-accurate molecular testing in a single-use and consumer-friendly test kit that is powered by two AA batteries and fits in the palm of a hand. We believe the novel coronavirus, or COVID-19, pandemic has shown the infectious disease testing infrastructure in the United States was not designed to accommodate the immediate demands of infectious disease control on a mass-population scale. The testing options today are too expensive, inaccurate, or are inaccessible due to slow time to results or complexity. Our LUCIRA COVID-19 All-In-One Test Kit, or our COVID-19 test kit, is designed to provide a clinically relevant COVID-19 result within 30 minutes from sample collection. Our initial focus is within respiratory diseases, starting with COVID-19 and influenza A and B virus indications. On Nov. 17, 2020, we received an Emergency Use Authorization from the FDA for (1) prescription at-home use with self-collected nasal swab specimens in individuals aged 14 and older who are suspected of COVID-19 by their healthcare provider and (2) use at the point-of-care with self-collected nasal swab specimens in individuals aged 14 and older, and in individuals aged 13 and under when the specimen is collected by a healthcare provider at the point of care. (Note: Lucira Health upsized its IPO at pricing on Feb. 4, 2021: 9 million shares at $17 – up from 7.81 million shares at $15 to $17 in the prospectus – to raise $153 million; this IPO was priced at the top of its range.)",In vitro & in vivo diagnostic substances,57,2013,Contact Information,"1412 62nd Street Emeryville, California 94608",(510) 350-8071,http://www.lucirahealth.com/,"Lucira Health, Inc.",Financial Information,$573.92mil,$0.27 mil (last 12 months),$-22.3 mil (last 12 months),IPO Profile,LHDX,NASDAQ,9.0,$17.00 - $17.00,$153.0 mil,BofA Securities/ William Blair/ LifeSci Capital,,2/5/2021,Priced,Available only to Subscribers,Available only to Subscribers,Available only to Subscribers,Available only to Subscribers,
