General Information,"We intend to focus on industries that complement our management team’s background, and to capitalize on the ability of our management team to identify and acquire a business, focusing on the healthcare and technology sectors, where our management team has extensive experience. Sectors we plan on exploring include, but are not limited to, technologically advanced segments of the medical, biotechnology, digital, data and data science, industrial and financial fields. (Note: In an S-1/A filing dated Sept. 27, 2021, Maxpro Capital Acquisition – formerly known as Jade Mountain Acquisition – cut the size of its SPAC IPO to 9 million units, down from 10 million, at $10 each to raise $90 million.)",BLANK CHECKS,0,2021,Contact Information,"5/F-4, No. 89 Songren Road, Xinyi District Taipei City 11073",+886 2 7713 7952,,Maxpro Capital Acquisition Corp.,Financial Information,$116.92mil,$0 mil (last 12 months),$0 mil (last 12 months),IPO Profile,JMACU,NASDAQ,9.0,$10.00 - $10.00,$90.0 mil,"EF Hutton (formerly Kingswood, a division of Benchmark Investments)",-,10/8/2021,Priced,Available only to Subscribers,Available only to Subscribers,Available only to Subscribers,Available only to Subscribers
General Information,"MEC is a leading U.S.-based value-added manufacturing partner that provides a broad range of prototyping and tooling, production fabrication, coating, assembly and aftermarket components. Our customers operate in diverse end markets, including heavy- and medium-duty commercial vehicles, construction, powersports, agriculture, military and other end markets. We have developed long-standing relationships with our blue chip customers based upon a high level of experience, trust and confidence. “We Make Things Simple” by providing a diverse set of process offerings and a “one stop shop” for end-to-end solutions with benefits throughout the entire product lifecycle, including front-end collaboration in design and prototyping, product manufacturing, aftermarket components and ancillary supply chain benefits.",METAL FORGING & STAMPINGS,3100,1945,Contact Information,"715 South Street, Mayville, WS 53050, US",(920) 387-4500,http://www.mecinc.com,Mayville Engineering,Financial Information,$334.8mil,$354.5 mil (last 12 months),$17.9 mil (last 12 months),IPO Profile,MEC,NYSE,6.3,$17.00 - $17.00,$106.3 mil,Baird/ Citigroup/ Jefferies,UBS Investment Bank/ William Blair,5/9/2019,Priced,Available only to Subscribers,Available only to Subscribers,Available only to Subscribers,Available only to Subscribers
General Information,"McAfee has been a pioneer and leader in protecting consumers, enterprises, and governments from cyberattacks for more than 30 years with integrated security, privacy, and trust solutions. We built our platform through a deep, rich history of innovation and have established a leading global brand. Whether we are securing the digital experience of a consumer who is increasingly living life online, or defending many of the world’s largest enterprises and governments from sophisticated attacks and nation-state threats, McAfee is singularly committed to one mission: to protect all things that matter through leading-edge cybersecurity.",PREPACKAGED SOFTWARE,6850,1987,Contact Information,"6220 America Center Drive San Jose, CA 95002",(866) 622-3911,http://www.mcafee.com,McAfee Corp.,Financial Information,$3391.52mil,$2745.0 mil (last 12 months),$-59.0 mil (last 12 months),IPO Profile,MCFE,NASDAQ,37.0,$20.00 - $20.00,$740.0 mil,Morgan Stanley/ Goldman Sachs/ TPG Capital BD/ BofA Securities/ Citigroup,RBC Capital Markets/ Deutsche Bank Securities/ UBS Investment Bank/ HSBC/ Mizuho Securities/ Evercore ISI/ Piper Sandler/ Stifel/ Academy Securities/ Blaylock Van/ C.L. King & Associates/ Ramirez & Co./ Siebert Williams Shank,10/22/2020,Priced,Available only to Subscribers,Available only to Subscribers,Available only to Subscribers,Available only to Subscribers
General Information,"We intend to focus on software, technology-enabled and business services companies and other companies that align with the background of our sponsor and management team. Our sponsor, MCAP Acquisition, LLC, is managed by an affiliate of Monroe Capital LLC, a Delaware limited liability company founded in 2004, and Monroe Capital Management Advisors, LLC, an SEC-registered investment adviser (collectively “Monroe Capital”), which is an asset manager focused on investing in middle-market companies. As of Sept. 30, 2020, Monroe Capital had approximately $9.1 billion in assets under management. Previously, Monroe Capital co-founded and co-sponsored Thunder Bridge Acquisition, Ltd. (Nasdaq: TBRG) and Thunder Bridge Acquisition II, Ltd. (Nasdaq: THBR), special-purpose acquisition companies (“SPACs”) that raised gross proceeds of $258 million and $345 million, respectively. In July 2019, Thunder Bridge Acquisition, Ltd. completed its business combination with Repay Holdings, LLC, a provider of vertically integrated payment solutions, together with its parent, Hawk Parent Holdings, LLC. In December 2020, Thunder Bridge Acquisition II, Ltd. announced it entered into a definitive agreement for a business combination with Ay Dee Kay, LLC d/b/a indie Semiconductor (“indie Semiconductor”), a pure-play provider of next-generation semiconductor and software solutions for the rapidly growing Autotech market. The consummation of this business combination is expected to close during the first quarter of 2021. (Note: MCAP Acquisition upsized its SPAC IPO at pricing on Feb. 25, 2021: 27.5 million units, up from 25 million, were priced at $10 each to raise $275 million.)",BLANK CHECKS,0,2020,Contact Information,"311 South Wacker Drive, Suite 6400 Chicago, Illinois 60606",(312) 258-8300,,MCAP Acquisition Corporation,Financial Information,$337.5mil,$0 mil (last 12 months),$0 mil (last 12 months),IPO Profile,MACQU,NASDAQ,27.5,$10.00 - $10.00,$275.0 mil,Cowen,-,2/26/2021,Priced,Available only to Subscribers,Available only to Subscribers,Available only to Subscribers,Available only to Subscribers
General Information,"Banking, financial services and insurance businesses that use AI and FinTech are in focus at this Irvine, California-based SPAC. (Note: McLaren Technology Acquisition Corp. priced its SPAC IPO on Nov. 2, 2021, in line with the terms of its prospectus: 17.5 million units at $10 each to raise $175 million. This SPAC had downsized its IPO from its initial size of 20 million units in an S-1/A filing with the SEC.)",BLANK CHECKS,0,2021,Contact Information,"2600 Michelson Drive Suite 2700 Irvine, CA 92612",(949) 989-4638,,McLaren Technology Acquisition Corp.,Financial Information,$218.75mil,$0 mil (last 12 months),$0 mil (last 12 months),IPO Profile,MLAIU,NASDAQ,17.5,$10.00 - $10.00,$175.0 mil,Mizuho Securities,-,11/3/2021,Priced,Available only to Subscribers,Available only to Subscribers,Available only to Subscribers,Available only to Subscribers
General Information,"We intend to focus on companies in transportation and logistics, telecommunications, financial services and professional services. Given the operational experience of our management team, we also intend to focus geographically by pursuing opportunities located in the Heartland. We will seek to acquire a single business with an aggregate enterprise value of $600 million or greater. Franklin McLarty, our executive chairman, has extensive experience as an operator and investor across various industries, including transportation, real estate, reinsurance, media and finance. In 2020, Mr. McLarty was a key investor in the $125 million private investment in public equity (“PIPE”) in connection with CarLotz, Inc.’s business combination with Acamar Partners Acquisition Corp. CarLotz is one of the largest vehicle retail disruptors with the industry’s only consignment-to-retail sales platform. Mr. McLarty is a co-founder and the chairman of McLarty Capital Partners (rebranded as The Firmament Group). (Note: MDH Acquisition upsized its IPO at pricing on Feb. 1, 2021, to 24 million units, up from 20 million units.)",BLANK CHECKS,0,2020,Contact Information,"600 N. Carroll Ave., Suite 100 Southlake, TX 76092",(415) 968-4444,,MDH Acquisition Corp.,Financial Information,$487.5mil,$0 mil (last 12 months),$0 mil (last 12 months),IPO Profile,MDH.U,NYSE,24.0,$10.00 - $10.00,$240.0 mil,Stifel/ Oppenheimer & Co.,-,2/2/2021,Priced,Available only to Subscribers,Available only to Subscribers,Available only to Subscribers,Available only to Subscribers
General Information,"(This is NOT an IPO. This is an uplift to the NASDAQ from the Euronext Brussels.) (Note: MDxHealth SA describes this offering as “our IPO of American Depositary Shares (“ADSs”) in the United States. We are offering 3,750,000 American Depositary Shares (“ADSs”) through the underwriters named in this prospectus, assuming a sale price of $13.46 per ADS, the closing price of our ordinary shares on the Euronext Brussels on Oct. 27, 2021. Each ADS represents 10 ordinary shares.”) We are a commercial-stage precision diagnostics company committed to providing non-invasive, clinically actionable and cost-effective urologic solutions to improve patient care. Our novel prostate cancer genomic testing solutions, SelectMDx and ConfirmMDx, provide physicians with a clear clinical pathway to accurately identify clinically significant prostate cancer while minimizing the use of invasive procedures that are prone to complications. Our unique approach combines advanced clinical modeling with genomic data to provide each patient with a personalized cancer risk profile, which provides more accurate and actionable information than standard risk factors (e.g., Prostate Specific Antigen (“PSA”), digital rectal exam (“DRE”), age) used by clinicians. Our lead products address men at risk for developing prostate cancer, but in addition, we are actively developing testing solutions to help with the management of men diagnosed with prostate cancer, with the goal to provide our clients with a menu of tools spanning the continuum of prostate cancer diagnosis and care. Our expertise in precision diagnostics and our portfolio of novel biomarkers for diagnostic, prognostic and predictive molecular assays supports our active pipeline of new testing solutions for prostate and other urologic diseases. Prostate cancer is presently the most common, and second deadliest, form of cancer in men. Approximately 25 million PSA tests are performed each year, and over 15% of these reveal heightened PSA levels, leading to an estimated pool of over three million undiagnosed men informed each year of their heightened risk for prostate cancer based on elevated PSA test results. Other than repeated invasive needle biopsy procedures, these symptomatic men and their clinicians have limited tools to manage their cancer risk. (Note: MDxHealth priced its IPO on Nov. 3, 2021, at US$12 on 3.75 million shares, the same number of shares in the prospectus, to raise $45 million.)",Diagnostics - SERVICES-COMMERCIAL PHYSICAL & BIOLOGICAL RESEARCH,,2003,Contact Information,"CAP Business Center Zone Industrielle des Hauts-Sarts 4040 Herstal, Belgium",+32 4 257 70 21,,MDxHEALTH SA,Financial Information,,$19.31 mil (last 12 months),$-28.25 mil (last 12 months),IPO Profile,MDXH,NASDAQ,3.8,$12.00 - $12.00,$45.0 mil,Piper Sandler/ Oppenheimer & Co./ BTIG/ KBC Securities,-,11/4/2021,Priced,Available only to Subscribers,Available only to Subscribers,Available only to Subscribers,Available only to Subscribers
General Information,"(Note: IPOScoop has “No Call” on this offering. This is NOT a traditional IPO. This is a “step-up” or “uplift” IPO of ADS on the NASDAQ by a company whose ordinary shares trade on the Tel Aviv Stock Exchange Ltd. (TASE) under the symbol “MEAT.” From the prospectus: “This is our initial public offering of American Depositary Shares, or ADSs. We are offering 1,655,630 ADSs. Each ADS represents 10 ordinary shares, no par value. Based on the last reported sale price of our ordinary shares on the TASE on March 2, 2021, we have assumed an initial public offering price of $15.10 per ADS.”)  We are a technology company focused on developing and out-licensing our proprietary three-dimensional printing technology, biotechnology processes and customizable manufacturing processes to food processing and food retail companies seeking to manufacture proteins without the need for animal slaughter. We are developing a novel proprietary three-dimensional bioprinter to deposit layers of differentiated stem cells, scaffolding, and cell nutrients in a three-dimensional form of structured cultured meat. We are initially focused on developing cultured meat steak technology. We believe we are the first company to be developing both a proprietary bioprinter and the related processes for growing cultured meat to focus on what we believe is a high value sector of the alternative protein market.  (Note: MeaTech 3D Ltd. priced its “uplift” IPO on March 11, 2021: 2.43 million ADS, each representing 10 ordinary shares, at US$10.30 per ADS, to raise $25.0 million. The pricing terms represent an increase in the number of ADS – to 2.43 million from 1.66 million in the prospectus – and a drop in the ADS price to $10.30 – down from the assumed price of $15.10 in the prospectus – to raise $25 million – nearly the same amount as the estimated proceeds.)",FOOD & KINDRED PRODUCTS,,2018,Contact Information,"18 Einstein St., P.O. Box 4061 Ness Ziona 7414001 Israel",972 -77-541-2206,,MeaTech 3D Ltd.,Financial Information,$1537.94mil,$0 mil (last 12 months),$-13.33 mil (last 12 months),IPO Profile,MITC,NASDAQ,2.4,$10.30 - $10.30,$25.0 mil,H.C. Wainwright & Co.,-,3/12/2021,Priced,Available only to Subscribers,Available only to Subscribers,Available only to Subscribers,Available only to Subscribers
General Information,"We created a new category of enterprise software, experience management, and we are the market leader. Our award-winning SaaS platform, the Medallia Experience Cloud, captures experience data from massive and expanding signal fields emitted by customers and employees on their daily journeys and is a leader in the market for understanding and managing omni-channel experiences. We utilize our proprietary AI technology to analyze structured and unstructured data from these signal fields across human, digital and IoT interactions at great scale to derive personalized and predictive insights that drive action with tremendous business results.","COMPUTER PROGRAMMING, DATA PROCESSING",1258,2000,Contact Information,"575 Market Street, Suite 1850, San Francisco, CA 94105, US",(650) 321-3000,http://www.medallia.com,Medallia,Financial Information,$2587.7mil,$336.6 mil (last 12 months),$-57.3 mil (last 12 months),IPO Profile,MDLA,NYSE,15.5,$21.00 - $21.00,$325.5 mil,BofA Merrill Lynch/ Citigroup/ Wells Fargo Securities/ Credit Suisse,Oppenheimer/ SunTrust Robinson Humphrey/ William Blair/ Needham & Company/ Craig-Hallum Capital Group/ Roth Capital Partners,7/19/2019,Priced,Available only to Subscribers,Available only to Subscribers,Available only to Subscribers,Available only to Subscribers
General Information,"Our mission is to help insurance carriers and distributors target and acquire customers more efficiently and at greater scale through technology and data science. Our technology platform brings leading insurance carriers and high-intent consumers together through a real-time, transparent, and results-driven ecosystem. We believe we are the largest online customer acquisition channel in our core verticals of property & casualty insurance, health insurance, and life insurance, supporting over $1 billion in Transaction Value across our platform over the last two years. For the 12-month period ended June 30, 2020, we had 15 of the top 20 largest auto insurance carriers by customer acquisition spend as demand partners on our platform, accounting for 39.6% of our revenue. We generate revenue by earning a fee for each Consumer Referral sold on our platform. Our revenue is not contingent on the sale of an insurance product to the consumer.",Insurance Carriers,89,2014,Contact Information,"700 South Flower Street, Suite 640 Los Angeles, California 90017",(213) 316-6256,http://www.mediaalpha.com,"MediaAlpha, Inc.",Financial Information,$1115.3mil,$479.6 mil (last 12 months),$36.5 mil (last 12 months),IPO Profile,MAX,NYSE,9.3,$19.00 - $19.00,$175.8 mil,J.P. Morgan/ Citigroup/ Credit Suisse/ RBC Capital Markets/ Canaccord Genuity/ William Blair,MUFG,10/28/2020,Priced,Available only to Subscribers,Available only to Subscribers,Available only to Subscribers,Available only to Subscribers
General Information,(We are a newly organized blank check company incorporated in November 2020 as a Cayman Islands exempted company.) We intend to capitalize on our management team’s background and experience to identify promising opportunities in the medical technology sector.,BLANK CHECKS,0,2020,Contact Information,"152 West 57th Street, Floor 20 New York, New York 10019, NY",(212)259-8400,,Medicus Sciences Acquisition Corp.,Financial Information,$101mil,$0 mil (last 12 months),$0 mil (last 12 months),IPO Profile,MSACU,NASDAQ,8.0,$10.00 - $10.00,$80.0 mil,Maxim Group,-,2/16/2021,Priced,Available only to Subscribers,Available only to Subscribers,Available only to Subscribers,Available only to Subscribers
General Information,"Medirom Healthcare Technologies Inc. is one of the leading holistic health services providers in Japan. Medirom is a franchiser and operator of healthcare salons across Japan and a preferred platform partner for large consumer brands, healthcare service providers, and government entities to affect positive health outcomes. Through our well-known retail salon brands, including primarily Re.Ra.Ku®, nascent tech platforms, and targeted health consulting and marketing, we have formed a “healthtech” segment. The healthtech segment’s goal is to improve health outcomes and the satisfaction of our customers, as well as offer corporations data-rich targeted advertising and promotional opportunities. We operate two synergistic lines of businesses: (1) Relaxation Salon Segment (retail); and (2) Digital Preventative Healthcare Segment (healthtech). (Note: Medirom Healthcare Technologies, Inc., upsized its IPO at pricing on Dec. 28, 2020, to 800,000 American Depositary Shares (ADS), up from 715,000 ADS in an F-1/A filing on Dec. 22, 2020, and priced the IPO at $15 per ADS to raise $12.0 million. The ADS began trading on Dec. 29, 2020, on the NASDAQ.)",PERSONAL SERVICES,233,2000,Contact Information,"2-3-1 Daiba, Minato-ku Tokyo 135-0091, Japan",+81-(0)3-6721-7364,https://medirom.co.jp/en/,"Medirom Healthcare Technologies, Inc.",Financial Information,$72.3mil,$3.2 mil (last 12 months),$-479.7 mil (last 12 months),IPO Profile,MRM,NASDAQ,0.8,$15.00 - $15.00,$12.0 mil,Maxim Group LLC,-,12/29/2020,Priced,Available only to Subscribers,Available only to Subscribers,Available only to Subscribers,Available only to Subscribers
General Information,"We intend to focus on businesses primarily operating in the healthcare sector in the United States. (Note: MedTech Acquisition Corp. upsized its IPO to price 22 million units, up from 20 million, at $10 each to raise $220 million.)",BLANK CHECKS,0,2020,Contact Information,"600 Fifth Avenue, 22nd Floor New York, NY 10022",(908) 391-1288,,MedTech Acquisition Corporation,Financial Information,$250.0mil,$0 mil (last 12 months),$0 mil (last 12 months),IPO Profile,MTACU,NASDAQ,22.0,$10.00 - $10.00,$220.0 mil,Raymond James,-,1/18/2021,Priced,Available only to Subscribers,Available only to Subscribers,Available only to Subscribers,Available only to Subscribers
General Information,"We provide disposable medical devices (Class I, Class II and Class III) to hospitals, pharmacies and medical institutions in China as well as in more than 30 countries in Asia, Europe, North America and South America, and Africa. (Incorporated in the Cayman Islands) Products range from ID bracelets, masks and medical dressings to polyethylene bottled products, such as eye drop bottles and tablet bottles, to high-end medical consumables and medical equipment such as blood glucose meters, cardiovascular equipment and abdominal cardiopulmonary resuscitation equipment. (Note: Meihua International Medical Technologies downsized its IPO at pricing on February. 15, 2022, to 3.6 million shares, down from 5.0 million in the prospectus, and priced the IPO at $10 – the mid-point of its $9-to-$11 range – to raise $36 million.)",Disposable medical devices,629,1990,Contact Information,"88 Tongda Road, Touqiao Town Guangling District, Yangzhou, 225000 People’s Republic of China",+86-0514-89800199,,Meihua International Medical Technologies,Financial Information,$250.0mil,$94.0 mil (last 12 months),$17.94 mil (last 12 months),IPO Profile,MHUA,NASDAQ,3.6,$10.00 - $10.00,$36.0 mil,Prime Number Capital/ Shengang Securities,Revere Securities/ R.F. Lafferty & Co.,2/16/2022,Priced,Available only to Subscribers,Available only to Subscribers,Available only to Subscribers,Available only to Subscribers
General Information,"We are a pioneer and leader in China’s used car financing market, focusing on facilitating loans from financial institutions to prime borrowers in used car transactions. We facilitated a total of 206,116 used car financing transactions in 2018, which ranked us among top three used car financing solution providers in China, according to the Frost & Sullivan Report. In the six months ended June 30, 2019, we facilitated 112,682 used car financing transactions with a transaction value of RMB7,886.7 million, representing a 43.1% increase from the transaction value in the six months ended June 30, 2018.",BUSINESS SERVICES,5343,2017,Contact Information,"20/F, Greenland Building, Wangjing Hongtai Dong Street, Chaoyang District, Beijing, People’s Republic of China",+86-10-8303-0999,http://www.mljr.com,Meili Auto Holdings,Financial Information,,$273.7 mil (last 12 months),$-21.5 mil (last 12 months),IPO Profile,ML,NYSE,0.0,$0.00 - $0.00,$100.0 mil,UBS Investment Bank/ Deutsche Bank Securities/ Nomura/ CICC,Needham & Company/ Tiger Brokers,,TBA,Available only to Subscribers,Available only to Subscribers,Available only to Subscribers,Available only to Subscribers
General Information,"Note: This is a SPAC IPO of Class A ordinary shares. It is NOT a typical SPAC unit offering. We intend to focus our search for an initial business combination on technology-enabled companies operating in Latin America across a number of verticals, including, but not limited to, commerce, financial services, logistics, healthcare, education, enterprise software and entertainment. (Incorporated in the Cayman Islands) MELI Kaszek Pioneer reunites MELI’s founders and key members of the founding team, who worked as a cohesive unit from the company’s start in 1999 to 2011. They were pioneers in identifying the potential for disruption through technology in Latin America. MELI became the region’s most valuable technology company in terms of market capitalization, as of the date of this prospectus. Several of MELI’s founders were subsequently pioneers in bringing global venture capital at scale to the vibrant Latin American tech ecosystem, and Kaszek is now the largest early-stage technology-focused venture capital manager in Latin America. (Note: MELI Kaszek Pioneer Corp. priced its SPAC IPO on Sept. 28, 2021, in line with the terms in its prospectus: 25 million Class A ordinary shares (NOT units) at $10 each to raise $250 million.)",BLANK CHECKS,0,2021,Contact Information,"78 SW 7th Street Individual Office No. 07-156 Miami, Florida 33130",598 2927 2770,,MELI Kaszek Pioneer Corp.,Financial Information,$370.0mil,$0 mil (last 12 months),$0 mil (last 12 months),IPO Profile,MEKA,NASDAQ,25.0,$10.00 - $10.00,$250.0 mil,BofA Securities/ Goldman Sachs/ Allen & Co./ J.P. Morgan,-,9/29/2021,Priced,Available only to Subscribers,Available only to Subscribers,Available only to Subscribers,Available only to Subscribers
