General Information,"We are a newly incorporated blank check company, incorporated as a Cayman Islands exempted company. While we may pursue a business combination target in any industry or geographical location, we currently intend to concentrate our efforts in identifying businesses with premium brands that offer an aspirational lifestyle experience to consumers, which we refer to as the “aspirational lifestyle space.” Our management team is led by: *Ravi Thakran, our chairman and CEO; he is the group chairman of LVMH South and South East Asia and Australia/New Zealand, representing a portfolio of over 75 brands, including wine and spirits, fashion and leather goods, perfumes and cosmetics, and watches and jewelry. *Mark Bedingham, our vice chairman; he has more than 30 years of experience leading the global expansion of premium brands in international markets, including Moet Hennessey in the Asia Pacific market, with an emphasis on China; and *Lisa Myers, our president; she is the co-founder and managing partner of Clerisy, a new global private equity firm in the consumer and consumer-technology space. She previously was a partner at L Catterton, where she focused on the L Catterton Flagship Buyout Fund. Before joining L Catterton, Ms. Myers spent 19 years with Franklin Templeton, where she was an executive vice president in Templeton’s Global Equity Group, which managed more than $100 billion in assets. She managed some of Templeton’s flagship global equity funds and institutional separate managed accounts, and served as the coordinator of Templeton’s global consumer research with direct research responsibility for the global retail, textile and apparel, and luxury goods sectors.",BLANK CHECKS,0,2020,Contact Information,1 Kim Seng Promenade #18-07/12 Great World City Singapore 237994,+65 6672 7605,,Aspirational Consumer Lifestyle Corp.,Financial Information,,$ mil (last 12 months),$ mil (last 12 months),IPO Profile,ASPL.U,NYSE,22.5,$10.00 - $10.00,$225.0 mil,Credit Suisse,,9/23/2020,Priced,Available only to Subscribers,Available only to Subscribers,Available only to Subscribers,Available only to Subscribers,
General Information,"This is a REIT (real estate investment trust) focused on investing in, developing, redeveloping and managing a portfolio of primarily affordable and workforce multifamily housing in Opportunity Zones, as designated by the Tax Cuts and Jobs Act of 2017, within dynamic, U.S. metropolitan areas. We believe we will be the first publicly traded REIT to pursue a strategy focused on affordable and workforce multifamily housing in Opportunity Zones. We are externally managed and advised by Aspire REIT Manager, LLC, a newly formed entity controlled by affiliates of Avanath Capital Management, LLC and MacFarlane Partners, LLC, two of the largest African American-owned real estate companies in the U.S. (Note: “Opportunity Zone” means a population census tract that is a low-income community designated by the governor or other chief executive of the relevant state (including the District of Columbia) or territory as a “qualified opportunity zone” for U.S. federal income tax purposes and certified as such by the U.S. Department of the Treasury pursuant to the 2017 Tax Act.)",REIT,0,2020,Contact Information,"1920 Main Street, Suite 150 Irvine, California 92614",(949) 269-4700,,"Aspire Real Estate Investors, Inc.",Financial Information,,$ mil (last 12 months),$ mil (last 12 months),IPO Profile,ASPI,NYSE,15.0,$20.00 - $20.00,$300.0 mil,Morgan Stanley/ B. Riley Securities/ Wells Fargo Securities/ BMO Capital Markets/ Keybanc Capital Markets,Loop Capital Markets/ Ramirez & Co./ Siebert Williams Shank,11/17/2020,Withdrawn,Available only to Subscribers,Available only to Subscribers,Available only to Subscribers,Available only to Subscribers,
General Information,"AssetMark is a leading provider of extensive wealth management and technology solutions that power independent financial advisers and their clients. Our platform enables advisers to outsource high-cost and specialty services that would otherwise require significant investments of time and money—helping to level the playing field for independent financial advisers of all sizes. We provide an end-to-end experience, spanning nearly all elements of an adviser’s engagement with his or her client—from initial conversations to ongoing financial planning discussions, including performance reporting and billing.",INVESTMENT ADVICE,620,1996,Contact Information,"1655 Grant Street, 10th Floor, Concord, CA 94520, US",(925) 521-2200,http://www.assetmark.com,AssetMark Financial Holdings,Financial Information,$1592.8mil,$371.4 mil (last 12 months),$30.4 mil (last 12 months),IPO Profile,AMK,NYSE,12.5,$22.00 - $22.00,$275.0 mil,J.P. Morgan/ Goldman Sachs/ Credit Suisse/ Huatai Securities (USA),BMO Capital Markets/ Raymond James/ William Blair,7/18/2019,Priced,Available only to Subscribers,Available only to Subscribers,Available only to Subscribers,Available only to Subscribers,
General Information,"We are a newly organized blank-check company incorporated in Delaware. Our CEO, Felipe Gonzalez, is the CEO of Strongrock Associates SL (“Strongrock”), a London-based investment office. Mr. Gonzalez focuses on the origination, underwriting and management of investments in industries across developed and developing markets. We intend to focus our efforts on sourcing and evaluating businesses in industries or sectors in which our management team has a broad and deep relationship network of private companies, and proven investment track record. Strongrock´s current investments are spread across the food and beverage/hospitality, financial services, technology, consumer, real estate and transportation sectors, and its team also has significant experience with sectors such as telecom and media and industrials.",BLANK CHECKS,0,2020,Contact Information,"55 Ocean Lane Drive, Apt. 3021 Key Biscayne, Florida 33149",(347) 607-8025,,Astrea Acquisition,Financial Information,$191.8mil,$0 mil (last 12 months),$0 mil (last 12 months),IPO Profile,ASAXU,NASDAQ,15.0,$10.00 - $10.00,$150.0 mil,"EarlyBirdCapital, Inc.",-,2/4/2021,Priced,Available only to Subscribers,Available only to Subscribers,Available only to Subscribers,Available only to Subscribers,
General Information,"(Note: This biotech company is focused on developing synthetic psychedelic compounds to treat mental health disorders, including treatment-resistant depression, anxiety and substance abuse disorder. Billionaire Peter Thiel invested $12 million in this start-up in November 2020 through Thiel Capital, his venture capital firm, as part of a $125 million private fund-raising round, CNBC reported.) We have a bold and ambitious vision: to heal mental health disorders so that everyone, everywhere can live a more fulfilled life. We are a clinical-stage biopharmaceutical company aiming to transform the treatment of mental health disorders. We founded atai Life Sciences in 2018 as a response to the significant unmet need and lack of innovation in the mental health treatment landscape, as well as the emergence of therapies that previously may have been overlooked or underused, including psychedelic compounds and digital therapeutics. We have built a pipeline of 10 development programs and six enabling technologies, each led by focused teams with deep expertise in their respective fields and supported by our internal development and operational infrastructure. We believe that several of our therapeutic programs’ target indications have potential market opportunities of at least $1 billion in annual sales, if approved. One of our atai companies, Recognify Life Sciences, has initiated a Phase 2a trial in the United States. We expect to initiate a Phase 2 trial for another program in 2021 and an additional three Phase 2 trials for other programs in 2022. We also expect to initiate Phase 1 trials for two of our programs in 2021 and an additional four in 2022. Mental health disorders such as depression, substance use disorder, or SUD, and anxiety, which are among our initial focus indications, are highly prevalent and estimated to affect more than one billion people globally. Additionally, it is expected that more than 50% of the U.S. population will be diagnosed with a mental health disorder at some point in their lifetime, with increasing incidence ascribed to the COVID-19 pandemic. Those suffering from mental health disorders have higher mortality rates than the general population and often experience decreased quality of life as a result of emotional, behavioral or physical manifestations. In addition, the total costs of mental health disorders are significant and expected to increase substantially. Between 2009 and 2019, spending on mental health care in the United States increased by more than 50%, reaching $225 billion. A Lancet Commission report estimates the global economic cost will reach $16 trillion by 2030. While current treatments, such as selective serotonin reuptake inhibitors, or SSRIs, and serotonin-norepinephrine reuptake inhibitors, or SNRIs, are well established and effective for certain patients, a significant percentage of patients either respond inadequately or relapse, translating to a significant unmet patient need. Note: Revenue is license revenue for the last 12 months. The net loss figure shown here is also for the last 12 months.",PHARMACEUTICAL PREPARATIONS,35,2018,Contact Information,"c/o Mindspace Krausenstraße 9-10 10117 Berlin, Germany",+49 89 2153 9035,,ATAI Life Sciences B.V.*,Financial Information,$2126.04mil,$19.88 mil (last 12 months),$-153.54 mil (last 12 months),IPO Profile,ATAI,NASDAQ,15.0,$15.00 - $15.00,$225.0 mil,Credit Suisse/ Citigroup/ Cowen/ Berenberg,Cantor/ RBC Capital Markets/ Canaccord Genuity,6/18/2021,Priced,Available only to Subscribers,Available only to Subscribers,Available only to Subscribers,Available only to Subscribers,
General Information,"We are a clinical-stage biopharmaceutical company focused on discovering, developing and commercializing antiviral therapeutics to improve the lives of patients suffering from life-threatening viral infections. Leveraging our deep understanding of antiviral drug development, nucleoside biology, and medicinal chemistry, we have built a proprietary purine nucleotide prodrug platform to develop novel product candidates to treat single stranded ribonucleic acid, or ssRNA, viruses, which are a prevalent cause of severe viral diseases. Currently, we are focused on the development of orally available, potent, and selective nucleotide prodrugs for difficult-to-treat, life-threatening viral infections, including severe acute respiratory syndrome coronavirus 2, or SARS-CoV-2, the virus that causes COVID-19, hepatitis C virus, or HCV, dengue virus, and respiratory syncytial virus, or RSV. We believe our team’s expertise from decades of developing innovative antiviral treatments uniquely positions us to advance medicines that have the potential to cure some of the world’s most severe viral diseases by inhibiting the enzymes central to viral replication.",Pharmaceuticals,19,2012,Contact Information,"125 Summer Street Boston, MA 02110",(857) 284-8891,http://www.ateapharma.com/,Atea Pharmaceuticals,Financial Information,$1937.8mil,$0 mil (last 12 months),$-22.3 mil (last 12 months),IPO Profile,AVIR,NASDAQ,12.5,$24.00 - $24.00,$300.0 mil,J.P. Morgan/ Morgan Stanley/ Evercore ISI/ William Blair,-,10/30/2020,Priced,Available only to Subscribers,Available only to Subscribers,Available only to Subscribers,Available only to Subscribers,
General Information,"We intend to focus our efforts identifying businesses offering technology-enabled consumer goods and/or services. We intend to focus on companies that have powerful and differentiated relationships with their customers, and that have market-leading insight into how their consumers live, what they need, and how to communicate with them effectively. These companies may serve both domestic and international audiences. We believe that growth in these sectors has been driven by new technologies, the expansion of emerging markets and new consumption habits led by “Millennials” and “Gen Z” who tend to place value on experiences, well-being and preventative care, and transparency in the production of the goods and services they consume. Some may also reflect trends accelerated by the recent COVID-19 pandemic.  (Note: Athena Consumer Acquisition Corp. priced its SPAC IPO on Oct. 19, 2021, in line with the terms in its prospectus: 20 million units at $10 each to raise $200 million.)",BLANK CHECKS,0,2021,Contact Information,"442 5th Avenue New York, NY 10018",(970) 925-1572,,Athena Consumer Acquisition Corp.,Financial Information,$280.0mil,$0 mil (last 12 months),$0 mil (last 12 months),IPO Profile,ACAQ.U,NYSE,20.0,$10.00 - $10.00,$200.0 mil,Citigroup,-,10/20/2021,Priced,Available only to Subscribers,Available only to Subscribers,Available only to Subscribers,Available only to Subscribers,
General Information,"We intend to focus our efforts identifying businesses in technology, direct to consumer and FinTech industries. (Note: This new blank-check company is unusual in that its board chair, its CEO and its CFO are all women – at a time when most SPACs or blank-check companies are still run by men. This special-purpose acquisition company (SPAC), incorporated in Delaware, is named after the Greek Goddess of War, the daughter of Zeus. She sprang from his head, fully clothed and in armor, according to Greek mythology.) Our management team is led by Isabelle Freidheim, the chairman of our Board of Directors; Phyllis Newhouse, our Chief Executive Officer and Director, and Grace Vandecruze, our Chief Financial Officer. Ms. Freidheim and Ms. Newhouse have long-standing careers focused on identifying, evaluating and effecting strategic and financing transactions across a range of industries. Our team is designed to leverage technology, private and public market expertise to identify and execute a successful transaction. Isabelle Freidheim is the co-founder of Magnifi, an AI and machine learning FinTech company that was acquired by The Tifin Group. She is also a co-founder and managing partner of Starwood VC, a venture investment firm. Phyllis W. Newhouse, our CEO, is an entrepreneur, a retired military senior non-commissioned officer, a mentor and the founder and CEO of XtremeSolutions, Inc., an Atlanta-based cybersecurity firm (“XSI”). She is also a founder of ShoulderUp, a nonprofit organization dedicated to connecting and supporting women on their entrepreneurial journeys. Grace Vandecruze, our CFO, is the founder and managing director at Grace Global Capital LLC, a consulting firm providing M&A financial advisory, restructuring, and valuation to insurance executives, boards and financial regulators since 2006. (Note: Athena Technology Acquisition Corp. priced its SPAC IPO on March 16, 2021, in line with the terms in its prospectus: 25 million units at $10 each to raise $250 million.)",BLANK CHECKS,0,2020,Contact Information,"125 Townpark Drive, Suite 300 Kennesaw, GA 30144",(970) 924-0446,,Athena Technology Acquisition Corp.,Financial Information,$342.66mil,$0 mil (last 12 months),$0 mil (last 12 months),IPO Profile,ATHN.U,NYSE,25.0,$10.00 - $10.00,$250.0 mil,Citigroup,CastleOak Securities/Siebert Williams Shank,3/17/2021,Priced,Available only to Subscribers,Available only to Subscribers,Available only to Subscribers,Available only to Subscribers,
General Information,"We expect to focus on a target in an industry where we believe the expertise of our management team and advisors will provide us with a competitive advantage. Our expertise lends itself well to pursuing companies operating in the FinTech, enterprise, deep tech and health-tech sectors. We also intend to look for businesses that create, produce, own, distribute and/or market content, products and services or facilitate the sharing economy. We believe that growth in these sectors has been driven by new technologies, the expansion of emerging markets and new consumption habits led by “Millennials” (ages 25 to 40) and “Gen Z” (ages 18-24) who tend to place value on experiences, well-being and preventative care, and transparency in the production of the goods and services they consume. Some may also reflect trends accelerated by the recent COVID-19 pandemic. We are among the few blank check companies led by women in the C-Suite as well as by a board of directors — all women — and strategic advisors, who are all women. Isabelle Freidheim has served as our CEO since August 2021 and as chairman of the Board of Directors since November 2021. Ms. Freidheim is the founder and chairman of Athena Technology Acquisition Corp. (NYSE: ATHN), one of the first all women SPACs. She is also the founder and chairman of Athena Consumer Acquisition Corp. (NYSE: ACAQ). She is a venture capitalist and entrepreneur; she was a co-founder of Magnifi, a FinTech company. She was a co-founder and managing partner of Castle VC (formerly Starwood VC), a venture investment firm, and a venture partner at MissionOG, a venture capital firm. Ms. Freidheim started her career in investment banking at Lehman Brothers and then joined one of Invesco’s private equity funds to invest in European assets. She holds a B.A. in Economics from Columbia University and an M.B.A. from Columbia Business School. Anna Apostolova has served as our Chief Financial Officer since October 2021. Anna Apostolova brings over 13 years of investment banking and private equity experience. Since 2020, Ms. Apostolova is a private equity investor at 7RIDGE, sourcing and executing investments in the financial technology space, with a particular focus on early and late-stage growth companies within capital markets, market infrastructure, investment management and associated technologies. Kirthiga Reddy has served as our President since August 2021 and as a Director since November 2021. Kirthiga Reddy brings over twenty years of experience leading technology-driven transformations. From December 2018 – October 2021, Ms. Reddy has served as the Investment Partner at SoftBank Investment Advisers, a private equity firm headquartered in London (SBIA), and served on the Investment Committee for the SoftBank Vision Fund Emerge program, a global accelerator for companies led by underrepresented founders. (Note: Athena Technology Acquisition Corp. II priced its SPAC IPO on Dec. 9, 2021, in sync with the terms in its prospectus: 25 million units at $10 each to raise $250 million.)",BLANK CHECKS,0,2021,Contact Information,"442 5th Avenue New York, NY 10018",(970) 925-1572,,Athena Technology Acquisition Corp. II,Financial Information,,$0 mil (last 12 months),$0 mil (last 12 months),IPO Profile,ATEK.U,NYSE,25.0,$10.00 - $10.00,$250.0 mil,Citigroup,-,12/10/2021,Priced,Available only to Subscribers,Available only to Subscribers,Available only to Subscribers,Available only to Subscribers,
General Information,"We are a late clinical-stage biopharmaceutical company focused on developing small molecules to restore neuronal health and stop neurodegeneration. With our product candidates, we aim to provide rapid cognitive improvement and alter the course of neurological diseases with our novel mechanism of action. Our approach is designed to augment neuronal growth factor signaling through HGF/MET, a naturally occurring regenerative system. We believe enhancing HGF/MET signaling has the potential to protect existing neurons from damage, reduce inflammation, promote regeneration, and positively modulate brain activity. We anticipate that all of these characteristics may improve neuronal health and translate into clinical benefits. Our pipeline is built from our proprietary drug discovery platform, or ATH platform, and consists of a series of small molecules that are designed to target either (1) the central nervous system, or CNS, by crossing the blood brain barrier, or BBB, or (2) the peripheral nervous system. Our lead candidate, ATH-1017, is a subcutaneous administered, BBB-penetrating, small molecule HGF/MET activator. In our Phase 1a and Phase 1b clinical trials, ATH-1017 for the treatment of Alzheimer’s disease, or AD, was well tolerated with no serious adverse events. These clinical trials recruited 88 subjects, including 11 subjects with mild-to-moderate AD.",BIOLOGICAL PRODUCTS (NO DIAGNOSTIC SUBSTANCES),15,2011,Contact Information,"4000 Mason Road, Suite 300, Seattle, WA 98195, US",(206) 221-8112,http://www.athira.com,Athira Pharma,Financial Information,$523.94mil,$0 mil (last 12 months),$-6.3 mil (last 12 months),IPO Profile,ATHA,NASDAQ,12.0,$17.00 - $17.00,$204.0 mil,Goldman Sachs/ Jefferies / Stifel,JMP Securities,9/18/2020,Priced,Available only to Subscribers,Available only to Subscribers,Available only to Subscribers,Available only to Subscribers,
General Information,"We intend to focus our efforts on businesses in the health, wellness and fitness sectors and the products, devices, applications, and technology driving growth within these verticals. Our sponsor is an affiliate of Causeway Media Partners (“Causeway”). Founded in 2013, Causeway is an investment fund focused on the sports, fitness and related industries. Causeway is led by: Wyc Grousbeck, former general partner at Highland Capital Partners and lead owner of the Boston Celtics; Mark Wan, co-founder of Three Arch Partners and co-owner in both the Boston Celtics and the San Francisco 49ers; and Bob Higgins, co-founder of Highland Capital Partners. The limited partners of Causeway include professional team owners from the NFL, NBA, MLB, and other leagues. In addition, Causeway’s limited partners include media executives, financial institutions, and general partners from a dozen private equity firms. Select portfolio companies of Causeway include Formula E, SeatGeek and SportsEngine.",BLANK CHECKS,0,2020,Contact Information,"c/o Causeway Media Partners, 44 Brattle St., Cambridge, MA 02138, US",(617) 855-6333,,Athlon Acquisition,Financial Information,$290mil,$0 mil (last 12 months),$0 mil (last 12 months),IPO Profile,SWETU,NASDAQ,24.0,$10.00 - $10.00,$240.0 mil,Jefferies,-,1/12/2021,Priced,Available only to Subscribers,Available only to Subscribers,Available only to Subscribers,Available only to Subscribers,
General Information,"We intend to focus on businesses in the next-generation mobility sector. We intend to evaluate compelling opportunities related to mobility markets; digital platforms that expand access to mobility; sensor technologies and enabling components; autonomous computing and fleet management systems; next-generation aviation; new powertrain technologies and sustainable infrastructure as they relate to mobility and industrial applications, all of which we believe complement the core competencies of our team and meet our acquisition criteria. (Note: Atlantic Coastal Acquisition Corp. priced its SPAC IPO on March 3, 2021, in line with the terms in its prospectus: 30 million units at $10 each to raise $300 million.)",Blank Checks,0,2020,Contact Information,"6 St Johns Lane, Floor 5 New York, NY 10013",(248)-890-720,,Atlantic Coastal Acquisition Corp.,Financial Information,$375.0mil,$0 mil (last 12 months),$0 mil (last 12 months),IPO Profile,ACAHU,NASDAQ,30.0,$10.00 - $10.00,$300.0 mil,BTIG,-,3/4/2021,Priced,Available only to Subscribers,Available only to Subscribers,Available only to Subscribers,Available only to Subscribers,
General Information,"We intend to focus on targets in the next-generation mobility or related technology sectors. We intend to evaluate compelling opportunities related to mobility markets; digital platforms that expand access to mobility; sensor technologies and enabling components; autonomous computing and fleet management systems; next-generation aviation; new powertrain technologies; sustainable infrastructure as they relate to mobility and industrial applications, all of which we believe complement the core competencies of our team and meet our acquisition criteria. Shahraab Ahmad is our chairman and CEO. He also serves as CEO and chairman of Atlantic Coastal Acquisition Corp. I, a related blank-check company. Before this, he was the CIO of Decca Capital Ltd., a fund he founded that invested in the U.S. and Europe from April 2015 and December 2018. His previous experience includes working for J.P. Morganfrom 1999 to 2004, where he last co-headed the High Yield Credit trading group.  (Note: Atlantic Coastal Acquisition Corp. II upsized at pricing on Jan. 13, 2022, to 26.1 million units, up from 25.0 million units initially, at $10 each to raise $261 million.)",BLANK CHECKS,0,2021,Contact Information,"6 St Johns Lane, Floor 5 New York, NY 10013",(248)-890-7200,,Atlantic Coastal Acquisition Corp. II,Financial Information,$323.5mil,$0 mil (last 12 months),$0 mil (last 12 months),IPO Profile,ACABU,NASDAQ,26.1,$10.00 - $10.00,$261.0 mil,Cantor,,1/14/2022,Priced,Available only to Subscribers,Available only to Subscribers,Available only to Subscribers,Available only to Subscribers,
