General Information,"Note: This is NOT an IPO. Amplitude, Inc., is offering shares of Class A common stock in a direct listing on the NASDAQ, with its stock expected to begin trading on or about Sept. 28, 2021. There are no underwriters. The financial advisors for the direct listing are Morgan Stanley, BofA Securities, Inc., Citigroup Global Markets Inc., KeyBanc Capital Markets Inc., Robert W. Baird & Co. Incorporated, UBS Securities LLC, (UBS Investment Bank”), and William Blair & Company, L.L.C. Note: NASDAQ set a reference price of $35 for Amplitude’s Class A common stock on Monday, Sept. 27, 2021, after the stock market’s close, Bloomberg reported. The reference price is meant only as a guide. **Note: Amplitude’s stock opened at $50 on Tuesday, Sept. 28, 2021, when the stock started trading on NASDAQ after its direct listing. At that opening price, the direct listing raised $1.77 billion when it began trading on the NASDAQ. The stock closed on Tuesday at $54.80. Background: In the third quarter of 2021 through Sept. 10, 2021, a total of 176,990 shares of Amplitude were sold at a volume-weighted average price of $35.41 in private transactions, according to the prospectus. We are pioneering a new category of software called Digital Optimization. Our Digital Optimization System serves as the command center for businesses to connect digital products to business outcomes. Digital optimization is emerging as a strategic investment for every company to survive in the digital-first world. Digital products are embedded in every part of our daily lives. In 2020, U.S. adults spent nearly 8 hours on average per day on digital activities. Digital has become the primary way business is done, and the ability for companies to offer compelling digital products and services has become a matter of survival. Digital products have become the center of how companies interact with customers. Digital-native companies like Twitter, DoorDash, PayPal, and Dropbox invest heavily in product innovation to fuel a product-led adoption model. It is not only the companies born in the past two decades that are betting it all on digital. Walmart, Disney, and IBM are reinventing their businesses around digital. Digital is the battleground and the businesses that fail to rise to the challenge and adapt to this new reality will face an existential crisis.",SERVICES - PREPACKAGED SOFTWARE,490,2011,Contact Information,"201 Third Street, Suite 200 San Francisco, California 94103",(650) 988-5131,,"Amplitude, Inc.",Financial Information,$7096.6mil,$128.9 mil (last 12 months),$-24.5 mil (last 12 months),IPO Profile,AMPL,NASDAQ,35.4,$50.00 - $50.00,$1770.0 mil,Morgan Stanley/ BofA Securities/ Citigroup/ KeyBanc Capital Markets/ Baird/ UBS Investment Bank/ William Blair,-,9/28/2021,Priced,Available only to Subscribers,Available only to Subscribers,Available only to Subscribers,Available only to Subscribers,
General Information,"Our mission is to develop therapies that change the treatment paradigm for amyotrophic lateral sclerosis, or ALS, and a broad range of neurodegenerative diseases by keeping neurons alive. Unlike most other cells in the body that regularly die and are replaced as part of healthy function, mature neurons are normally resistant to cell death and generally cannot regenerate. We are pursuing commercialization of our product candidate, AMX0035, which we believe is the first drug candidate to show both a functional and survival benefit in a large-scale clinical trial of patients with ALS. We submitted a New Drug Submission, or NDS, in Canada in the second quarter of 2021 for AMX0035 for the treatment of ALS, which was accepted for review in the third quarter of 2021, and a New Drug Application, or NDA, to the U.S. Food and Drug Administration, or FDA, in the fourth quarter of 2021, which was accepted for priority review in the same quarter. We also intend to submit a Marketing Authorization Application, or MAA, in Europe early in the first quarter of 2022. The results of our Phase 2 clinical trial of AMX0035, known as the CENTAUR trial, were published in September 2020 in the New England Journal of Medicine and in October 2020 in the Journal of Muscle and Nerve and demonstrated functional and survival benefits for ALS patients. We believe AMX0035 has the potential to be a foundational therapy, meaning that it could be used alone or in conjunction with other therapies to change the treatment paradigm across a broad range of neurodegenerative diseases. AMX0035 is a dual UPR-Bax apoptosis inhibitor composed of sodium phenylbutyrate, or PB, and TURSO (also known as tauroursodeoxycholic acid, or TUDCA). Through the resolution of the unfolded protein response, or UPR, and by inhibiting translocation of the Bcl-2 Associated X-protein, or Bax, to the outer mitochondrial membrane, we have shown in multiple models that AMX0035 can keep neurons alive under a variety of different conditions and stresses, including in in vitro models of neurodegeneration, endoplasmic reticulum stress, mitochondrial dysfunction, oxidative stress and disease-specific models of a variety of other conditions, as well as in vivo models of ALS, Alzheimer’s Disease, or AD, and multiple sclerosis. We are pursuing ALS as our first indication as it is a disease of rapid and profound neurodegeneration. We are actively pursuing regulatory approvals of AMX0035 for the treatment of ALS in Canada, the United States and, in the near-term, Europe. We have recently initiated a Phase 3 clinical trial of AMX0035 for the treatment of ALS, known as the PHOENIX trial, at clinical trial sites in the United States and Europe. (Note: Amylyx Pharmaceuticals, Inc. upsized its IPO at pricing on Jan.6, 2022, to 10.0 million shares, up from 8.75 million in the prospectus, and priced the IPO at $19 – the mid-point of its $18-to-$20 range – to raise $190 million.)",PHARMACEUTICAL PREPARATIONS,110,2014,Contact Information,"43 Thorndike St. Cambridge, Massachusetts 02141",(617) 682-0917,http://www.amylyx.com/,"Amylyx Pharmaceuticals, Inc.",Financial Information,$1049.18mil,$0 mil (last 12 months),$-68.2 mil (last 12 months),IPO Profile,AMLX,NASDAQ,10.0,$19.00 - $19.00,$190.0 mil,Goldman Sachs/ Leerink & Co./ Evercore ISI,H.C. Wainwright & Co.,1/7/2022,Priced,Available only to Subscribers,Available only to Subscribers,Available only to Subscribers,Available only to Subscribers,
General Information,"We are a clinical-stage biopharmaceutical company developing treatments for rare, chronic and serious infectious diseases with high unmet needs. Our initial product candidate is epetraborole, a once-daily oral treatment for patients with chronic non-tuberculous mycobacterial, or NTM, lung disease. Epetraborole has broad spectrum antimycobacterial activity through inhibition of an essential and universal step in bacterial protein synthesis. Its novel mechanism of action is enabled by boron chemistry, our core technology approach. There are an estimated 200,000 patients with NTM lung disease in the United States; however, many remain underdiagnosed due to lack of clinical suspicion, nonspecific respiratory symptoms, and underlying lung diseases that are frequent in patients with this infection. We intend to conduct trials and pursue marketing authorizations with epetraborole in additional geographies outside of the United States and Europe, with an initial focus in Japan. We estimate that there are approximately 20,000 patients with NTM lung disease and approximately 5,600 patients with treatment-refractory MAC lung disease in Europe (United Kingdom, Germany, France, Italy, and Spain). We estimate that there are approximately 220,000 patients with NTM lung disease and approximately 21,000 patients with treatment-refractory MAC lung disease in Japan. We plan to conduct a Phase 2/3 pivotal clinical trial in treatment-refractory Mycobacterium avium complex, or MAC, lung disease, which is the most common type of NTM lung disease. Interim data from our completed Phase 1b dose-ranging study of epetraborole administered orally for 28 days in healthy volunteers in Australia and data from our two nonclinical chronic toxicology studies (six-month rats and nine-month non-human primates) have informed our selection of a 500 mg once-daily dose for our Phase 2/3 pivotal clinical trial in treatment-refractory MAC lung disease patients. We believe our Phase 2/3 pivotal clinical trial design, which is under review by the U.S. Food and Drug Administration, or FDA, has the potential to be sufficient for regulatory approval in the United States.  We recently received clearance of our Investigational New Drug, or IND, application by the FDA to begin our Phase 1 renal impairment study, for which enrollment commenced in February 2022, and plan to initiate patient enrollment in our Phase 2/3 pivotal clinical trial in the first half of 2022, with topline results for the Phase 2 part of the trial anticipated in the middle of 2023 and for the Phase 3 part of the trial anticipated in the middle of 2024, pending any sample size adjustments that may be required to the Phase 3 portion based on treatment effects of epetraborole-containing regimens that may be observed in the Phase 2 portion of the trial, if any. We also recently received Fast Track designation by the FDA to investigate epetraborole for treatment-refractory MAC lung disease. Epetraborole has also recently been designated as a Qualified Infectious Disease Product, or QIDP, for treatment-refractory MAC lung disease by the FDA and received FDA orphan drug designation for the treatment of infections caused by NTM. *Note: Net loss is for the year ended Dec. 31, 2021. (Note: AN2 Therapeutics, Inc. upsized its IPO at pricing to 4.6 million shares and priced the IPO at $15 – the mid-point of its $14-to-$16 range – to raise $69 million.)",Pharmaceutical,22,2017,Contact Information,"1800 El Camino Real, Suite D, Menlo Park, California 94027",(650) 331-9090,http://www.an2therapeutics.com/,"AN2 Therapeutics, Inc.",Financial Information,$281.1mil,$0 mil (last 12 months),$-21.57 mil (last 12 months),IPO Profile,ANTX,NASDAQ,4.6,$15.00 - $15.00,$69.0 mil,Cowen/ SVB Leerink/ Evercore ISI,Oppenheimer & Co.,3/25/2022,Priced,Available only to Subscribers,Available only to Subscribers,Available only to Subscribers,Available only to Subscribers,
General Information,"Michael M. Andretti, the celebrated race car driver, is the co-CEO of this blank-check company or SPAC, which will focus on the automotive industry. (Incorporated in the Cayman Islands) We intend to leverage the extensive experience and vast network of our management team to complete our initial business combination. Two key members of our management team are racing legends Mario and Michael Andretti: Mario Andretti is a former Formula One World Champion racecar driver and one of only three drivers to win races in Formula One, IndyCar, World Sportscar Championship and the National Association for Stock Car Auto Racing (“NASCAR”). He is one of only two drivers to have won both the Daytona 500 and the Indy 500. His son, Michael Andretti, won the PPG IndyCar World Series in 1991 and has tallied 42 race wins throughout his career. As owner of Andretti Autosport, Michael Andretti has led his team to over 200 race wins, including four IndyCar Championships.  This legacy has made Andretti a household name with 75% of Americans familiar with the iconic brand, which connotes luxury, lifestyle and performance. Among its many successes, Andretti Autosport has leveraged the popularity of the Andretti brand to undertake sustainability initiatives, including helping underprivileged communities, as well as developing a competitive electric vehicle platform powered by renewable energy. The Andretti brand is complemented by Andretti Technologies, an advanced engineering and innovation arm that has enabled Andretti to raise the bar for automotive performance. We currently seek to focus on opportunities that can benefit from the iconic Andretti brand name, both inside and outside of the worldwide motor sports platform and the expertise and ability of our management team to identify, acquire and grow a business in the broadly defined automotive industry. This industry includes but is not limited to advanced mobility and related next-generation technologies, premium and performance vehicles and replacement automotive parts. (Note: Andretti Acquisition Corp. priced its SPAC IPO on Jan. 12, 2022, in line with the terms in its prospectus: 20 million units at $10 each to raise $200 million.)",BLANK CHECKS,0,2021,Contact Information,"7615 Zionsville Road Indianapolis, Indiana 46268",(317) 872-2700,,Andretti Acquisition Corp.,Financial Information,$250.0mil,$0 mil (last 12 months),$0 mil (last 12 months),IPO Profile,WNNR.U,NYSE,20.0,$10.00 - $10.00,$200.0 mil,RBC Capital Markets,-,1/13/2022,Priced,Available only to Subscribers,Available only to Subscribers,Available only to Subscribers,Available only to Subscribers,
General Information,"We are a clinical-stage biotechnology company developing novel solutions for people suffering from cannabinoid overdose and substance addiction. Our lead product candidate, ANEB-001, is intended to reverse the negative effects of cannabinoid overdose within 1 hour of administration. The signs and symptoms of cannabinoid overdose range from profound sedation to anxiety and panic to psychosis with hallucinations. There is no approved medical treatment currently available to specifically alleviate the symptoms of cannabinoid overdose and we are not aware of any competing products that are further along in the development process than ANEB-001 in reversing the effects of tetrahydrocannabinol (“THC”), the principal psychoactive constituent of cannabis. Clinical trials completed to date have shown that ANEB-001 is rapidly absorbed, well tolerated and leads to weight loss, an effect that is consistent with central cannabinoid receptor type 1 (“CB1”) antagonism. In March 2021, our European clinical trial application (“CTA”), which is equivalent to an investigational new drug application in the United States, was accepted in the Netherlands to allow us to utilize ANEB-001 in a Phase 2 proof-of-concept trial for cannabinoid overdose planned for the fourth quarter of 2021. Before the legalization of cannabis, an estimated 450,000 patients visited hospital emergency rooms for cannabis-related conditions. In 2014, this number more than doubled to an estimated 1.1 million patients, according to data published in “Trends and Related Factors of Cannabis-Associated Emergency Department Visits in the United States: 2006-2014,” Journal of Addiction Medicine (May/June 2019). Based on our own analysis of the most recent NEDS (The Nationwide Emergency Department Sample) data, we believe that the number of hospitalizations grew to 1.74 million patients in 2018. Excessive ingestion of THC via edible products such as candies and brownies, and overdoses of synthetic cannabinoids (also known as “synthetics,” “K2” or “spice”), are two leading causes of THC-related emergency room visits.",PHARMACEUTICAL PREPARATIONS,3,2020,Contact Information,"1415 Ranch Road 620 South, Suite 201 Lakeway, Texas 78734",(512) 598-0931,http://www.anebulo.com/,"Anebulo Pharmaceuticals, Inc.",Financial Information,$162.89mil,$0 mil (last 12 months),$-0.76 mil (last 12 months),IPO Profile,ANEB,NASDAQ,3.0,$7.00 - $7.00,$21.0 mil,The Benchmark Company,-,5/7/2021,Priced,Available only to Subscribers,Available only to Subscribers,Available only to Subscribers,Available only to Subscribers,
General Information,"Angel Oak Mortgage, Inc. is a real estate finance company focused on acquiring and investing in first lien non-QM loans and other mortgage-related assets in the U.S. mortgage market. Our strategy is to make credit-sensitive investments primarily in newly originated first lien non-QM loans that are primarily made to higher-quality non-QM loan borrowers and primarily sourced from Angel Oak’s proprietary mortgage lending platform, Angel Oak Mortgage Lending, which operates through wholesale and retail channels and has a national origination footprint. We also may invest in other residential mortgage loans, RMBS and other mortgage-related assets, which, together with non-QM loans, we refer to in this prospectus as our target assets. We commenced operations in September 2018 and have received $303 million in equity capital commitments since then. On Feb. 5, 2020, we formed our operating partnership through which substantially all of our assets are held and substantially all of our operations are conducted, either directly or through subsidiaries. As of March 31, 2021, we had total assets of approximately $534.9 million, including an approximate $481.0 million portfolio of non-QM loans and other target assets. Our portfolio consists primarily of mortgage loans and mortgage-related assets that have been underwritten in-house by Angel Oak Mortgage Lending, and are subject to Angel Oak Mortgage Lending’s rigorous underwriting guidelines and procedures. As of the date of origination and deal date of each of the loans underlying our portfolio of RMBS issued in AOMT securitizations that we participated in, such loans had a weighted average FICO score of 715, a weighted average LTV of 76.4% and a weighted average down payment of over $100,000. We have elected to be taxed as a REIT for U.S. federal income tax purposes commencing with our taxable year ended Dec. 31, 2019. Note: Angel Oak Mortgage reported net income of $736,000 for the year ended Dec. 31, 2020, according to the prospectus. (Note: Angel Oak Mortgage priced its IPO on June 16, 2021, at $19 – below its $20-$21 range – on 7.2 million shares, less than the 8.1 million shares in its prospectus, to raise $136.8 million.)",REIT,745,2018,Contact Information,"3344 Peachtree Road NE, Suite 1725 Atlanta, Georgia 30326",(404) 953-4900,http://www.angeloakreit.com/,"Angel Oak Mortgage, Inc.",Financial Information,$537.31mil,$35.9 mil (last 12 months),$46.9 mil (last 12 months),IPO Profile,AOMR,NYSE,8.1,$19.00 - $19.00,$136.8 mil,Wells Fargo Securities/ BofA Securities/ Morgan Stanley/ UBS Investment Bank/ B. Riley Securities,Nomura/ Oppenheimer & Co.,6/17/2021,Priced,Available only to Subscribers,Available only to Subscribers,Available only to Subscribers,Available only to Subscribers,
General Information,"We intend to focus on target businesses within the Greater China region, especially on companies within technology-enabled sectors, including but not limited to: e-commerce, enterprise software and cloud computing, and FinTech. (Incorporated in the Cayman Islands) Simon Xie, a co-founder of Alibaba Group, is a co-founder of Angel Pond Holdings Corp. The SPAC’s other co-founder is Theodore Wang, who will also serve as the CEO and chairman of this new blank-check company. Mr. Wang, a former Goldman Sachs partner, is the founder of both Angel Pond Capital and Puissance Capital Management. (Note: Angel Pond Holdings downsized its IPO at pricing on May 17, 2021, to 25 million units, down from 30 million units in the prospectus, at $10 each to raise $250 million.)",BLANK CHECKS,0,2021,Contact Information,"950 Third Avenue, 25th Floor New York, NY 10022",(212) 878-3702,,Angel Pond Holdings Corp.,Financial Information,$375.0mil,$0 mil (last 12 months),$0 mil (last 12 months),IPO Profile,POND.U,NYSE,25.0,$10.00 - $10.00,$250.0 mil,Goldman Sachs (Asia)/ J.P. Morgan,-,5/18/2021,Priced,Available only to Subscribers,Available only to Subscribers,Available only to Subscribers,Available only to Subscribers,
General Information,"We are a late-stage biopharmaceutical company focused on the discovery, development and commercialization of novel small molecule therapeutics to address acute organ injuries and fibrotic diseases. Our goal is to transform the treatment paradigm for patients suffering from these potentially life-threatening conditions for which there are no approved medicines or where existing approved medicines have limitations.  Our lead product candidate, ANG-3777, is a hepatocyte growth factor (HGF) mimetic that we are currently evaluating in multiple acute organ injuries and related indications, including acute kidney injury (AKI) and injuries to other major organs, such as the lungs, central nervous system (CNS) and heart. Within AKI, we are currently evaluating ANG-3777’s ability to improve kidney function and reduce the severity of transplant-associated AKI, also known as delayed graft function (DGF), in patients at risk for kidney dysfunction, as well as for the treatment of AKI associated with cardiac surgery involving cardiopulmonary bypass (CSA-AKI). We are also evaluating ANG-3777 for indications within acute lung injury (ALI), with our primary focus on acute respiratory distress syndrome (ARDS), as well as acute CNS injuries. We are advancing multiple programs for the treatment of fibrotic diseases, leading with ANG-3070, a tyrosine kinase inhibitor (TKI), and our inhibitor of rho kinase 2 (ROCK2). We also continue to develop other preclinical product candidates, including our CYP11B2 (aldosterone synthase) inhibitors, which we are investigating for the purpose of targeting aldosterone-related fibrotic diseases.",Pharmaceuticals,53,1998,Contact Information,"51 Charles Lindbergh Boulevard Uniondale, New York 11553",(415) 655-4899,,Angion Biomedica,Financial Information,$431.7mil,$3.12 mil (last 12 months),$-67.25 mil (last 12 months),IPO Profile,ANGN,NASDAQ,5.0,$16.00 - $16.00,$80.0 mil,Cowen/ Stifel,"H.C. Wainwright & Co., LLC/ Oppenheimer & Co.",2/5/2021,Priced,Available only to Subscribers,Available only to Subscribers,Available only to Subscribers,Available only to Subscribers,
General Information,"We intend to focus our search for business combination targets in digital financial services, or modern financial technology, although we may pursue an acquisition in any business industry or geographic region. (Incorporated in the Cayman Islands) Our proposed symbol “ADALU” is a nod to the first computer programmer, Ada Lovelace. Anthemis Digital Acquisitions I Corp will honor this technology pioneer by going to market with an all-female management team and board of directors led by financial technology innovator, Amy Nauiokas, founder and CEO of leading FinTech investor Anthemis Group and former financial services senior executive. Ms. Nauiokas made her reputation as a FinTech investor by backing early standout successes. including Zoopla, Climate Corporation, Happy Money, Betterment, Currencycloud and the leading European seed investor Seedcamp. Ms. Nauiokas is known for her tireless commitment to working for a more equitable and inclusive industry, hiring, investing in and mentoring diverse and underrepresented talent and supporting and sponsoring their growth.  (Note: Anthemis Digital Acquisitions priced its SPAC IPO on Oct. 27, 2021, in line with the terms in its prospectus: 20 million units at $10 each to raise $200 million.)",BLANK CHECKS,0,2021,Contact Information,"122 Hudson Street, 3rd Floor New York, New York 10013",(646) 757-1310,,Anthemis Digital Acquisitions I Corp.,Financial Information,$271.87mil,$0 mil (last 12 months),$0 mil (last 12 months),IPO Profile,ADALU,NASDAQ,20.0,$10.00 - $10.00,$200.0 mil,Barclays/ Credit Suisse,-,10/28/2021,Priced,Available only to Subscribers,Available only to Subscribers,Available only to Subscribers,Available only to Subscribers,
General Information,"We intend to focus our search for a target business by concentrating our efforts in identifying high-quality businesses with transformative technologies for industrial applications. Our CEO, Dr. Whitney Haring-Smith, is a co-founder and managing partner of Anzu Partners. Our sponsor is an affiliate of Anzu Partners, founder in 2014. Anzu Partners is an investment firm that focuses on industrial and life sciences technology companies with the potential to transform their industries. Dr. Haring-Smith was the co-founder and board chairman of College Abacus, a website that became the “Kayak.com of college financial aid” in the United States. From 2012 to 2014, College Abacus was featured in The New York Times, CNN Money, Yahoo Finance, CBS News, Fox Business, and other publications. In 2014, College Abacus was acquired by ECMC. Dr. Haring-Smith earned his doctorate from Oxford University, where he was a Rhodes Scholar. Our chairman is William Wulfsohn. He is the former CEO and chairman of Ashland Global Holdings, Inc., where he led Ashland’s transition to a focused specialty chemicals company and oversaw multiple spinouts and divestitures. This included the successful $5.3 billion separation of Valvoline, where Mr. Wulfsohn served as the founding chairman for the first year. (Note: Anzu Special Acquisition Corp. I further upsized its SPAC IPO at pricing on March 1, 2021: 42 million units, up from 35 million, at $10 each to raise $420 million. The deal had been increased by 40 percent to 35 million units, up from 25 million initially, at $10 each in an S-1/A filing dated Feb. 19, 2021.)",BLANK CHECKS,0,2020,Contact Information,"12610 Race Track Road, Suite 250 Tampa, FL 33626",(202) 742-5870,,Anzu Special Acquisition Corp I,Financial Information,$507.5mil,$0 mil (last 12 months),$0 mil (last 12 months),IPO Profile,ANZU.U,NASDAQ,42.0,$10.00 - $10.00,$420.0 mil,BofA Securities/ Barclays,-,3/2/2021,Priced,Available only to Subscribers,Available only to Subscribers,Available only to Subscribers,Available only to Subscribers,
