General Information,"(Note: This is a unit offering IPO. IPOScoop has NO CALL on unit offerings.) Agora was organized by our parent and principal stockholder, Ecoark Holdings, Inc. (“Ecoark”) to enter the digital asset mining business. Because of regulatory uncertainty over digital assets being deemed to be securities, Agora’s initial focus is on mining Bitcoin, which has not currently been deemed as a security. Because of regulatory concerns and the changing regulatory environment, we intend to seek opportunities to engage with cryptocurrencies that do not involve the offer or sale of any securities. (Incorporated in Nevada) On Sept. 22, 2021, Ecoark assigned 100% of the membership interests of Trend Discovery Holdings LLC to Agora, and Trend Discovery is now a wholly owned subsidiary of Agora. Through Trend Discovery, Agora operates the following wholly owned subsidiaries: Bitstream Mining LLC, Barrier Crest LLC, Trend Discovery Capital Management LLC and Trend Discovery Exploration LLC (“Trend Exploration”). We are keeping the Bitcoin we acquire in a digital wallet with Coinbase, a large digital asset exchange. We may use our companies for this purpose as well. We are subject to a variety of cybersecurity risks resulting from this arrangement. Bitstream was organized in the Spring of 2021 to be our principal cryptocurrency subsidiary. Bitstream has entered into a series of agreements, including arranging for a reliable and economical electric power source needed to efficiently mine Bitcoin, ordering miners, housing infrastructure and other infrastructure to mine Bitcoin and locate a third-party hosting service to operate our miners and the service’s more advanced miners. Agora has spent approximately $7.2 million and has agreed to spend approximately $6 million in connection with these agreements, not including future revenue sharing. We purchased 5,000 Canaan AvalonMiner 841 miners, of which 4,000 have been delivered, and 550 are currently being operated. On November 6, 2021, we commenced Bitcoin mining on a beta test basis. Because these Canaan AvalonMiner 841 miners are less powerful than the other miners we have ordered, we may lose money on our initial mining operations. Our hosting service expects to deploy Bitmain S19 Pro miners, which are expected to be operational in the first quarter of calendar year 2022. In order to advance our environmental, social and governance (“ESG”) strategy and seek a way to reduce the power costs of our planned mining activities, an Ecoark subsidiary made an intercompany assignment of certain oil and gas mineral leases to Agora’s subsidiary, Trend Exploration. Trend Exploration has been investigating the use of flared or stranded natural gas to fuel a turbine to generate the energy required to mine cryptocurrency. As we seek a solution, the oil wells generate approximately $100,000 per month of revenue at current prices. Barrier Crest provides fund administration and related services for small hedge funds. Trend Discovery owns an entity which is the general partner and manager, respectively, but not the investment manager, of two investment funds. These investment funds own shares of Ecoark and one also owns warrants of Ecoark. See “Certain Relationships and Related Party Transactions.” As reflected in the financial statements contained in this prospectus, during the period ended Dec. 31, 2021, a majority of our revenue was generated from Barrier Crest, Trend Capital Management and Trend Exploration. We expect a majority of our revenue to primarily be generated by Bitstream following the commencement of our initial cryptocurrency mining operations in November 2021.",Services - Computer Processing & Data Preparation,10,2019,Contact Information,"145 King Street, Suite 410 Charleston, South Carolina 29401",(800) 219-0518,,Agora Digital Holdings,Financial Information,,$0.48 mil (last 12 months),$-0.02 mil (last 12 months),IPO Profile,DEFYU,NASDAQ,0.0,$0.00 - $0.00,$0.0 mil,H.C. Wainwright & Co.,-,,TBA,Available only to Subscribers,Available only to Subscribers,Available only to Subscribers,Available only to Subscribers,
General Information,"We intend to focus our search on AgTech targets in agriculture, horticulture, and aquaculture that aim to improve yield, efficiency or profitability in the production, processing, distribution, provision of capital, or consumption of outputs, inputs, data, technology or other services (“AgTech”) located in the Americas. (Incorporated in the Cayman Islands) (Note: Agrico Acquisition Corp. priced its SPAC IPO on July 7, 2021, in line with the terms in its prospectus: 12.5 million units at $10 each to raise $125 million.)",BLANK CHECKS,0,2020,Contact Information,"Boundary Hall, Cricket Square Grand Cayman, KY1-1102, Cayman Islands",(346) 800-5508,,AgriFORCE Growing Systems Ltd.,Financial Information,$157.50mil,$0 mil (last 12 months),$0 mil (last 12 months),IPO Profile,RICOU,NASDAQ,12.5,$10.00 - $10.00,$125.0 mil,Maxim Group LLC,-,7/9/2021,Priced,Available only to Subscribers,Available only to Subscribers,Available only to Subscribers,Available only to Subscribers,
General Information,"We are a developer of highly advanced and proprietary precision hardware and software grow solutions for the indoor agriculture marketplace. We believe we are the only company with an automated and fully integrated grow solution in the indoor agriculture industry. We also believe our Agrify “Precision Elevated™” cultivation solution is vastly differentiated from anything else on the market in that it combines our seamlessly integrated hardware and software offerings with a wide range of associated services such as consulting, engineering, and construction to form what we believe is the most complete solution available from a single provider. The totality of our product mix and service capabilities form an integrated ecosystem in what has historically been an extremely fragmented market for the various components needed for indoor agriculture. As a result, we believe we are well situated to create a dominant market position in the indoor agriculture sector. (Note: Agrify further upsized its IPO at pricing on Jan. 27, 2021: 5.4 million shares, up from 5.0 million shares in its upsized filing, were priced at $10 to raise $54 million. The company had increased the IPO’s size by 80 percent to 5.0 million shares, up from 2.8 million shares initially, at the same price range of $8 to $10 each, in an S-1/A filing dated Jan. 26, 2021.)",Agricultural Goods & Services,40,2016,Contact Information,"101 Middlesex Turnpike, Suite 6, PMB 326, Burlington, MA 01803",6178965243,http://www.agrify.com,Agrify,Financial Information,$90.5mil,$9.4 mil (last 12 months),$-10.4 mil (last 12 months),IPO Profile,AGFY,NASDAQ,5.4,$10.00 - $10.00,$54.0 mil,Maxim Group/ Roth Capital Partners,-,1/28/2021,Priced,Available only to Subscribers,Available only to Subscribers,Available only to Subscribers,Available only to Subscribers,
General Information,"The companies that we will target have the potential to be disruptive and primed for explosive growth and that can change the world for the better, while establishing a position of technological dominance. We believe we are well positioned to pursue initial business combination opportunities within our four domains of interest: Planet & Efficient Energy; Brain & Artificial Intelligence; Genetics & Platform Technologies, and Space, Robotics & Physics. We will seek to identify differentiated opportunities. In Europe and the UK, where deep technology and deep science are very strong, enterprise valuations are in many cases currently attractive relative to other global locations. (Incorporated in the Cayman Islands) Alice Newcombe-Ellis is our CEO. She is the founding and general partner of Ahren, a London-based investment firm that she established alongside Ahren’s Science Partners in 2017. Alice has over a decade of investing experience, including at TPG Capital LLP (a leading global private equity firm with more than $70 billion of assets under management (“AUM”) as of March 30, 2021) and at Lansdowne Partners LLP (a leading investment firm with more than $11 billion AUM as of November 2020). Alice has had an investing focus predominantly in technology and disruptive healthcare. Alice holds a Double First-Class degree in Mathematics, and Master’s in Mathematics/Physics from the University of Cambridge. Alice was a Fulbright Scholar and a Baker Scholar at Harvard Business School.  (Note: Ahren Acquisition Corp. upsized its SPAC IPO at pricing on Dec. 14, 2021, to 27.5 million units, up from 25 million, at $10 each to raise $275 million.)",BLANK CHECKS,0,2021,Contact Information,"Boundary Hall, Cricket Square, Grand Cayman, KY1-1102, Cayman Islands",(646) 480-0033,,Ahren Acquisition Corp.,Financial Information,$337.5mil,$0 mil (last 12 months),$0 mil (last 12 months),IPO Profile,AHRNU,NASDAQ,27.5,$10.00 - $10.00,$275.0 mil,Citigroup,-,12/15/2021,Priced,Available only to Subscribers,Available only to Subscribers,Available only to Subscribers,Available only to Subscribers,
General Information,"We intend to focus our search on businesses in the fintech industry. Notwithstanding the foregoing, we will not pursue a target business that is headquartered in, or conducts a majority of its business in, China or Hong Kong. (Incorporated in the Cayman Islands) (Note: AIB Acquisition Corp. priced its SPAC IPO on Jan. 18, 2022, in line with the terms in its prospectus: 7.5 million units at $10 each to raise $75 million.)",BLANK CHECKS,0,2021,Contact Information,"875 Third Avenue, Suite M204A New York, New York 10022",,,AIB Acquisition Corp.,Financial Information,$98.02mil,$0 mil (last 12 months),$0 mil (last 12 months),IPO Profile,AIBBU,NASDAQ,7.5,$10.00 - $10.00,$75.0 mil,Maxim Group LLC,-,1/19/2022,Priced,Available only to Subscribers,Available only to Subscribers,Available only to Subscribers,Available only to Subscribers,
General Information,"We founded our company with the belief that environmental problems can be addressed while achieving commercial success. Since inception, we have transformed the pre-owned consumer electronics industry in China by facilitating recycle and trade-in services and further grown the industry by connecting and empowering all participants in the ecosystem. We remain excited about pursuing our mission and will leverage our platform and technology to continue to standardize mass-market pre-owned consumer goods. We are the largest pre-owned consumer electronics transactions and services platform in China in terms of GMV for electronics and the number of devices transacted by merchants and consumers, with a market share of 6.6% and 8.7% in terms of GMV for electronics and number of devices transacted, respectively, in 2020, according to the CIC Report. Our GMV for electronics and number of devices transacted on our platform for the year ended Dec. 31, 2020, were both greater than the next five largest platforms combined, according to the CIC Report. (Note: AiHuiShou priced its IPO on June 17, 2021, at $14 – the mid-point of its $13-to-$15 range – on 16.23 million ADS to raise $227.26 million.)",RETAIL STORES,2388,2011,Contact Information,"12th Floor, No. 6 Building, 433 Songhu Road, Shanghai, the People’s Republic of China",+86 21 5290-7031,https://www.aihuishou.com,AiHuiShou International Co. Ltd.,Financial Information,$3084.9mil,$890.6 mil (last 12 months),$-92.5 mil (last 12 months),IPO Profile,RERE,NYSE,16.2,$14.00 - $14.00,$227.3 mil,Goldman Sachs/ BofA Securities/ China Renaissance,GTJA/ CLSA/ Tiger Brokers/ CMBI/ Futu,6/18/2021,Priced,Available only to Subscribers,Available only to Subscribers,Available only to Subscribers,Available only to Subscribers,
General Information,"Our business strategy is to identify and complete our initial business combination with high growth technology and tech-enabled businesses domestically and abroad (excluding China, Hong Kong and Macau) in the consumer Internet, e-commerce, software, cloud computing, healthcare, transportation / mobility or financial services industries, as well as other industries that are being disrupted by advances in technology. (Incorporated in the Cayman Islands) Jing (“George”) Cao, our CEO and director, is an experienced technology and finance industry professional. In May 2018, Mr. Cao founded and has since served as the CEO of AscendEX, a global digital asset trading platform that offers a variety of products to global users. Since March 2018, he also has served as the CEO of HD Consulting Service LLC, a technology consulting service firm in New York, BMXDM Technology PTE. Limited, a technology holdings company for a trading platform, and Global Digital Mercantile Holdings Limited. From January 2013 to January 2018, Mr. Cao founded and served as the CIO of Delpha Capital Management, LLC, a New York-based firm that specialized in quantitative trading. From August 2010 to November 2012, Mr. Cao was a senior portfolio manager in the Equity Division of Barclays Capital in both their New York and London offices. From August 2008 to July 2010, Mr. Cao was a portfolio manager at Knight Capital Group, where he researched and traded U.S. equities. Mr. Cao earned a Ph.D. in computer science from the University of Chicago and a bachelor’s degree in computer science and engineering from the University of Science and Technology of China.",BLANK CHECK,0,2021,Contact Information,"1 Rockefeller Plaza, 11th Floor New York, NY 10020",(646) 722-2971,,Aimfinity Investment Corp. I,Financial Information,$92.0mil,$0 mil (last 12 months),$0 mil (last 12 months),IPO Profile,AIMAU,NASDAQ,7.0,$10.00 - $10.00,$70.0 mil,Tiger Brokers/ EF Hutton,-,,TBA,Available only to Subscribers,Available only to Subscribers,Available only to Subscribers,Available only to Subscribers,
General Information,"We are a cannabis cultivation, manufacturing and distribution company whose mission is to provide premium quality medical cannabis products to patients worldwide. We cultivate and process natural cannabis at our facilities in the Kingdom of Lesotho, Africa. We intend to supply medicinal-grade cannabis biomass, cannabis flower and cannabis concentrates to wholesalers in international markets. We also import and sell medical cannabis-based products to the domestic market in the United Kingdom. (Incorporated in Ontario, Canada) We are an early-stage company headquartered in London. We have a limited operating history and minimal revenues to date. We require funding from this offering to expand and further develop our operations in the Kingdom of Lesotho and to develop sales channels in international markets and in particular, in Europe, the United Kingdom and Africa. Our cultivation operations at Bophelo in the Kingdom of Lesotho were initially established in 2018. Our operations in Lesotho are dependent on access to land that is leased from a local non-profit development trust controlled by our Executive Chairman. Our distribution operations in the United Kingdom were established in 2019. Our revenues from the sale and distribution of medical cannabis in the United Kingdom have not exceeded $20,000 in any 12-month period since the inception of our operations in the United Kingdom. The medical cannabis market in the United Kingdom is still emerging. (Note: Akanda Corp. priced its IPO on March 14, 2022, in line with the recently downsized terms in its prospectus: 4 million shares at $4.00 each to raise $16 million. Akanda had relaunched the IPO in recent weeks after postponing the deal on Feb. 24, 2022, due to stock market conditions; word about the postponement circulated hours ahead of the deal’s expected pricing after the close on Thursday, Feb. 24. Akanda had cut its proposed IPO price to $4, down from the initial price range of $4 to $6; the company kept the number of shares at 4 million in an F-1/A filing dated Feb. 14, 2022.)",Medical Chemicals & Botanical Products,,2018,Contact Information,"Akanda Corp. 1a, 1b Learoyd Road New Romney TN28 8XU, United Kingdom",+44 (203) 488-9514,http://www.akanda.corp/,Akanda Corp.,Financial Information,,$0.02 mil (last 12 months),$-4.23 mil (last 12 months),IPO Profile,AKAN,NASDAQ,4.0,$4.00 - $4.00,$16.0 mil,Boustead Securities,-,3/15/2022,Priced,Available only to Subscribers,Available only to Subscribers,Available only to Subscribers,Available only to Subscribers,
General Information,"We are an innovative life sciences technology company delivering spatial biology solutions focused on transforming discovery and clinical research. Our mission is to deliver a revolutionary new class of spatially derived biomarkers that empower life sciences researchers to better understand disease and clinicians to improve patient outcomes. Spatial biology refers to a rapidly evolving technology that enables academic and biopharma scientists to detect and map the distribution of cell types and biomarkers across whole tissue samples at single cell resolution, enabling advancements in their understanding of disease progression and patient response to therapy. Through our CODEX and Phenoptics platforms, reagents, software and services, we offer end-to-end solutions to perform tissue analysis and spatial phenotyping across the full continuum, from discovery through translational and clinical research.",Laboratory Analytical Instruments,169,2015,Contact Information,"100 Campus Drive, 6th Floor Marlborough, MA 01752",(855) 896-8401,http://www.akoyabio.com/,"Akoya Biosciences, Inc.",Financial Information,$678.11mil,$42.44 mil (last 12 months),$-16.71 mil (last 12 months),IPO Profile,AKYA,NASDAQ,6.6,$20.00 - $20.00,$131.6 mil,J.P. Morgan/ Morgan Stanley/ Piper Sandler/ Canaccord Genuity,-,4/16/2021,Priced,Available only to Subscribers,Available only to Subscribers,Available only to Subscribers,Available only to Subscribers,
General Information,"We intend to concentrate our efforts on identifying a target business that is exiting the restructuring process or that has transient current ownership, with particular emphasis on businesses that have strong management teams, realigned capital structures, positive cash flows prospects, and a clear and well-defined pathway for growing profitably over the long-term. In addition, we intend to capitalize on the ability of our management team to identify, acquire, and manage a business that is exiting the restructuring process or that has transient current ownership, and which can benefit from their experience and differentiated global network. Our CEO and board chairman is Robert Kauffman, the founder of Aldel Capital, a private investment firm. He is also a former principal of Fortress Investment Group, which he co-founded in 1998. He previously was a managing director at UBS and, before that, he was a principal at BlackRock Financial Management. (Note: Aldel Financial priced its SPAC IPO on April 8, 2021, in line with the reduced terms in its amended prospectus: 10 million units at $10 each to raise $100 million. Aldel Financial cut its SPAC IPO in half to 10 million units at $10 each in an S-1/A filing dated March 25, 2021.)",BLANK CHECKS,0,2020,Contact Information,"105 S. Maple Street Itasca, Illinois 60143",(847) 791-6817,,Aldel Financial,Financial Information,$257.0mil,$0 mil (last 12 months),$0 mil (last 12 months),IPO Profile,ADF.U,NYSE,10.0,$10.00 - $10.00,$100.0 mil,ThinkEquity (a division of Fordham Financial Management),-,4/9/2021,Priced,Available only to Subscribers,Available only to Subscribers,Available only to Subscribers,Available only to Subscribers,
General Information,"Aleph is a leading global enabler of digital advertising, serving as a crucial link at the core of the global digital ecosystem by connecting the largest digital platforms with thousands of advertisers and billions of consumers in emerging and underserved countries. (Incorporated in the Cayman Islands) We have commercial and, in many cases, exclusive agreements with over 31 of the leading digital platforms, including: Twitter, Meta, Microsoft, Snapchat, TikTok, Spotify and Twitch. Through these relationships, we provide digital platforms with a sustainable and scalable way to monetize their advertising inventory in emerging countries at little additional cost and complexity. We combine these relationships with an extensive global footprint and an end-to-end digital advertising solution that enables advertisers in 77 countries to reach close to 3 billion consumers and maximize their digital advertising potential. (Note: Net revenue and net income figures are for the year ended on Dec. 31, 2021, according to the prospectus.) (Note: Some IPO experts estimate that this IPO could raise $300 million. Aleph Group, Inc., had filed confidentially for an IPO in October 2021, SEC records show.)",Advertising,350,2005,Contact Information,"22nd Street, 21, Villa 2B, Umm Suqeim 2 Dubai, United Arab Emirates",+971 42 64 89 99,,"Aleph Group, Inc.",Financial Information,,$131.1 mil (last 12 months),$26.32 mil (last 12 months),IPO Profile,ALEF,NYSE,0.0,$0.00 - $0.00,$300.0 mil,J.P. Morgan/ Citigroup/ Goldman Sachs/ BofA Securities/ UBS Investment Bank/ Deutsche Bank Securities/ BNP Paribas/ Macquarie Capital,-,,TBA,Available only to Subscribers,Available only to Subscribers,Available only to Subscribers,Available only to Subscribers,
General Information,"We provide solutions that bring transparency and accountability to the digital out of home, or “DOOH,” advertising marketplace. Alfi uses artificial intelligence and big data analytics to measure and predict human response. Our computer vision technology is powered by proprietary artificial intelligence, to determine the age, gender, ethnicity, geolocation and emotion of someone in front of an Alfi-enabled device, such as a tablet or kiosk. Alfi can then deliver in real-time, the advertisements to that particular viewer based on the viewer’s demographic and psychographic profile. Alfi delivers the right content, to the right person at the right time in a responsible and ethical manner. By delivering advertisements a viewer wants, we deliver our advertising customers the viewers they want and the result is higher click through rates, or CTRs and higher CPM, cost per thousand, rates.","COMPUTER PROGRAMMING, DATA PROCESSING",21,2018,Contact Information,"429 Lenox Avenue Suite 547 Miami Beach, Florida 33139",(305) 395-4520,http://www.getAlfi.com,"Alfi, Inc. (common)",Financial Information,$45.9mil,$0 mil (last 12 months),$-3.6 mil (last 12 months),IPO Profile,ALF,NASDAQ,3.7,$4.15 - $4.15,$15.5 mil,"Kingswood Capital Markets, (division of Benchmark Investments, Inc.)",-,5/4/2021,Priced,Available only to Subscribers,Available only to Subscribers,Available only to Subscribers,Available only to Subscribers,
General Information,"We provide solutions that bring transparency and accountability to the digital out of home, or “DOOH,” advertising marketplace. Alfi uses artificial intelligence and big data analytics to measure and predict human response. Our computer vision technology is powered by proprietary artificial intelligence, to determine the age, gender, ethnicity, geolocation and emotion of someone in front of an Alfi-enabled device, such as a tablet or kiosk. Alfi can then deliver in real-time, the advertisements to that particular viewer based on the viewer’s demographic and psychographic profile. Alfi delivers the right content, to the right person at the right time in a responsible and ethical manner. By delivering advertisements a viewer wants, we deliver our advertising customers the viewers they want and the result is higher click through rates, or CTRs and higher CPM, cost per thousand, rates.","COMPUTER PROGRAMMING, DATA PROCESSING",21,2018,Contact Information,"429 Lenox Avenue Suite 547 Miami Beach, Florida 33139",(305) 395-4520,https://www.getAlfi.com,"Alfi, Inc. (warrants)",Financial Information,$45.9mil,$0 mil (last 12 months),$-3.6 mil (last 12 months),IPO Profile,AFLIW,NASDAQ,3.0,$0.00 - $0.00,$0.0 mil,"Kingswood Capital Markets, (division of Benchmark Investments, Inc.)",-,5/4/2021,Priced,Available only to Subscribers,Available only to Subscribers,Available only to Subscribers,Available only to Subscribers,
